DOI	Title	Authors	Abstract	Journal	Date
10.1016/j.diabres.2025.112925	SGLT-2 inhibitors beyond diabetes: A new frontier in cancer treatment.	Nakhaei A, Delavar K, Azim AS, Afshari S, Mohtashami A, Jalili-Nik M, Jalali M, Ahmadi SS, Karav S, Afshari AR, Kesharwani P, Sahebkar A	Sodium-glucose co-transporter 2 (SGLT-2) inhibitors, a new class of antidiabetic medications including canagliflozin, dapagliflozin, ipragliflozin, and empagliflozin, recently came to light as possible anti-cancer therapeutics. The confirmed presence of SGLT-2 in many cancer cell lines further substantiates their potential as therapeutic targets. Because many cancer cells change their metabolism to become more glucose-dependent, blocking glucose absorption with	Diabetes research and clinical practice	26/09/2025
10.1016/j.lanhl.2025.100762	Single-domain and multidomain lifestyle interventions for the prevention of	Mendes AJ, Ribaldi F, Sayin O, Khachvani G, Mulargia R, Volpara G, Remoli G, Nencha U, Gianonni-Luza S, Cappa S, Frisoni GB	BACKGROUND: Preventing cognitive impairment in older adults is a public health priority. Although multidomain interventions have shown promise as preventive strategies, the optimal combination of interventions remains unclear. This network meta-analysis aimed to compare and rank the relative efficacy of single-domain and multidomain lifestyle interventions for the prevention of cognitive impairment in older adults who are cognitively unimpaired. METHODS: We did a systematic review and network meta-analysis of randomised controlled trials (RCTs) published in PubMed and Embase from inception until the date of our search on May 7, 2024 following a preregistered protocol in PROSPERO (CRD42024601975). We included RCTs in older adults who are cognitively unimpaired evaluating lifestyle interventions targeting diet, physical exercise, cognitive training, social activity, and health education, either alone or in combination. The primary outcome was global cognition, analysed using random-effects network meta-analysis, reporting standardised mean differences (SMDs) and 95% CIs, and compared against health education, active control, or no intervention. Subgroup analyses explored potential age-related differences and the effect of intervention duration. Risk of bias was assessed using Cochrane Risk of Bias 2, and publication bias was evaluated by assessing funnel plot asymmetry. FINDINGS: Of the 10 200 citations identified and 1183 full texts screened for eligibility, we identified 109 eligible RCTs, including 23 010 participants (median age 70·1 years [IQR 68·7-73·8], 14 957 [65%] female and 8053 [35%] male). Compared with health education, significant improvements in global cognition were found for physical exercise and cognitive training combined (SMD 0·26 [95% CI 0·10-0·42; p=0·0011); cognitive training alone (SMD 0·21 [0·08-0·33]; p=0·00092); diet, physical exercise, cognitive training, and health education combined (SMD 0·14 [0·02-0·27]; p=0·028); and physical exercise alone (SMD 0·14 [0·05-0·22]; p=0·0014). Random-effects models using active control and no intervention as comparators yielded similarly significant effects for the aforementioned interventions, with effect sizes in the same order. Risk of bias was high in 44 (40%) studies, and publication bias was suggested in studies comparing interventions with health education. INTERPRETATION: Several single-domain and multidomain lifestyle interventions are efficacious at modulating global cognition in older adults who are cognitively unimpaired, with the combination of physical exercise and cognitive training demonstrating the strongest effect. Combining lifestyle interventions might enhance efficacy, but increased number of domains does not automatically translate into greater cognitive benefits. These findings support lifestyle interventions as key components of prevention strategies; however, their optimal combination requires further investigation. FUNDING: None.	The lancet. Healthy longevity	25/09/2025
10.1002/ejhf.70057	Acute heart failure care - a consensus series of an international experts' group.	Cotter G, Biegus J, Fudim M, Miró Ò, Ambrosy AP, Pagnesi M, Chioncel O, Davison B, Freund Y, Bocchi EA, Butler J, Dzudie A, Harikrishnan S, Lima ICGV, Mentz RJ, Nauli SE, Riccardi M, Sato N, Savarese G, Sliwa K, Zhang Y, Zhou J, Mebazaa A, Collins S	The care of patients hospitalized for acute heart failure (AHF) has been largely unchanged from the early 1960s until a few years ago, consisting mainly of oxygen and diuretics supplemented sometimes by other vasoactive drugs. These treatments, although effective in the short term in controlling congestion, do not prevent early readmissions and death, occurring in over 30% of patients in the 6 months after an AHF hospitalization. In the last years, studies showed that AHF diagnosis can be improved, early diuretic care can be optimized, and early intensive therapy with combined drug regimens can reduce the rate of adverse outcomes. However, unlike acute coronary syndromes, where guidelines have existed since 1996, there are no separate detailed guidelines for AHF. In a series of four papers (International Expert Opinion Series on AHF Management) an international expert group highlights important aspects of AHF care where the evidence base to inform clinical practice is lacking. These papers focus on (1) diagnosis and treatment during prehospital and in the emergency department, (2) management during the first days of admission, (3) care before and after AHF discharge, and (4) hospitalized AHF management in patients presenting with cardiogenic shock, significant valvular disease, or end-stage renal disease. These papers are not intended to serve as guidelines, but rather to suggest a framework for future recommendations for the diagnosis and treatment of AHF. In the current summary paper, we highlight the main considerations and key recommendations in each of the parts of AHF care.	European journal of heart failure	28/09/2025
10.1038/s41467-025-63500-4	Gtf2i-encoded transcription factor Tfii-i regulates myelination via Sox10 and Mbp	Levy G, Rokach M, Fischer I, Kimchi-Feldhorn O, Shoob S, Bar E, Rosenberg T, Bartman J, Parnas H, Grad M, Israel-Elgali I, Sfadia GE, Trangle SS, Vainshtein A, Eisenbach YE, Jahn O, Siems SB, Werner HB, Shomron N, Assaf Y, Peles E, Slutsky I, Marco A, Barak B	The transcriptional regulatory network governing the differentiation and functionality of oligodendrocytes (OLs) is essential for the formation and maintenance of the myelin sheath, and hence for the proper function of the nervous system. Perturbations in the intricate interplay of transcriptional effectors within this network can lead to a variety of nervous system pathologies. In this study, we identify Gtf2i-encoded general transcription factor II-I (Tfii-i) as a regulator of key myelination-related genes. Gtf2i deletion from myelinating glial cells in male mice leads to functional alterations in central nervous system (CNS) myelin, including elevated mRNA and protein expression levels of myelin basic protein (Mbp), the central myelin component, enhanced connectivity properties, and thicker myelin wrapping axons with increased diameters. These changes resulted in faster axonal conduction across the corpus callosum (CC), and improved motor coordination. Furthermore, we show that in mature OLs (mOLs), Tfii-i directly binds to regulatory elements of Sox10 and Mbp. In the peripheral nervous system (PNS), Gtf2i deletion from Schwann cells (SCs) leads to hypermyelination of the tibial branch of the sciatic nerve (SN). These findings add to our understanding of myelination regulation and specifically elucidate a cell-autonomous mechanism for Tfii-i in myelinating glia transcriptional network.	Nature communications	26/09/2025
10.1016/j.canlet.2025.218064	Tumor-derived CCL5 recruits CCR1(+) macrophages to suppress apoptosis and drive	Li J, Zhang L, Zheng C, Lin X, Cao D, Zhao S, Wang S, Yu B, Wei G, Kong X, Liu X, He A, Xiao X, Xiang D	Duodenal adenocarcinoma (DA) is a rare gastrointestinal malignancy associated with poor prognosis and limited therapeutic options. To define the DA tumor microenvironment (TME), we performed single-cell RNA sequencing (scRNA-seq) on primary DA tumors and matched adjacent normal tissues. This analysis revealed substantial heterogeneity among malignant epithelial cells, including a transcriptionally distinct subset characterized by the upregulation of immune-related genes, which constitutes an immune-associated transcriptional program. Notably, this program included high expression of the chemokine CCL5, which facilitated the recruitment of CCR1(+) macrophages. Using patient-derived DA organoids, we identified malignant cells exhibiting immune-related transcriptional signatures, including elevated CCL5. Functional assays demonstrated that CCL5 promoted CCR1(+) macrophage migration, an effect suppressed by both the CCR1 antagonist BX471 and CCL5-neutralizing antibody. In co-culture, CCL5-expressing DA organoids displayed enhanced survival and proliferation in the presence of CCR1(+) macrophages, while pharmacological blockade of CCR1 significantly increased tumor cell death. Bulk transcriptomic profiling revealed that CCR1 downregulates pro-apoptotic signaling in tumor cells, thereby promoting cell survival and growth. Importantly, combining CCL5/CCR1 inhibitors with standard chemotherapeutic agents resulted in synergistic tumor cell killing. Together, our findings establish the CCL5/CCR1 axis as a key mediator of tumor-macrophage crosstalk in DA, supporting immune evasion and chemoresistance via suppression of macrophage-induced apoptosis. Targeting this axis may represent a promising therapeutic strategy to enhance the efficacy of conventional chemotherapy in DA.	Cancer letters	25/09/2025
10.1016/j.celrep.2025.116202	In vitro protocol demonstrating five functional steps of trained immunity in	González-Pérez M, Baranda J, Pérez-Rodríguez L, Conde P, Calle-Fabregat C, Berges-Buxeda MJ, Dimitrov A, Arranz J, Rius-Rocabert S, Zotta A, Dopazo A, Poddar N, Wang X, Nistal-Villán E, Duivenvoorden R, Madsen JC, Williams DL, Hasson D, Lozano-Ojalvo D, Ginhoux F, O'Neill LAJ, Ochando J	We developed an in vitro methodology to study trained immunity using murine bone-marrow-derived macrophages stimulated with β-glucan and lipopolysaccharide (LPS). Longitudinal analysis of interleukin (IL)-6 and tumor necrosis factor (TNF) production demonstrates that trained macrophages secrete higher cytokine levels following primary stimulation with β-glucan compared to unstimulated macrophages (step 1). After a resting period, trained macrophages return to basal levels of cytokine production (step 2) but rapidly produce enhanced levels of	Cell reports	25/09/2025
10.1001/jamapediatrics.2025.3568	Population-Level Effectiveness and Herd Protection 17 Years After HPV Vaccine	DeSieghardt A, Ding L, Ermel A, Franco EL, Dagnall C, Brown DR, Yao S, Kahn JA	IMPORTANCE: Human papillomavirus (HPV) vaccine clinical trials demonstrate high vaccine efficacy, but postlicensure population-level effectiveness data are needed to inform vaccination and cancer-prevention recommendations and policies. Little is known about effectiveness in adolescent girls and young adult women at high risk for HPV-related cancers or after 9-valent HPV vaccine (9vHPV) introduction. OBJECTIVE: To examine effectiveness and herd protection over the first 17 years after HPV vaccine introduction in adolescent girls and young women at increased risk for HPV infection and related cancers. DESIGN, SETTING, AND PARTICIPANTS: This cross-sectional study analyzed data from 6 surveillance studies from 2006 to 2023. A consecutive sample of sexually experienced adolescent girls and young women aged 13 to 26 years was recruited from clinical settings. EXPOSURE: Participants were stratified by HPV vaccination status; those who received at least 1 vaccine dose were defined as vaccinated. MAIN OUTCOMES AND MEASURES: Effectiveness and herd protection were assessed by comparing proportions of vaccinated and unvaccinated participants positive for at least 1 type in the 2-valent vaccine (2vHPV), 4-valent vaccine (4vHPV), and 9vHPV in each of 6 studies. The prevalence of vaccine-type HPV was compared in vaccinated participants from surveillance studies 2 through 6 vs participants recruited in surveillance study 1, all of whom were unvaccinated. Inverse probability of treatment weighting with propensity score was used to balance between-wave differences in participant characteristics. RESULTS: Of 2335 participants (mean [SD] age, 18.9 [2.7] years; 1526 African American [65.4%], 13 Asian [0.6%], 6 Native American [0.3%], 582 White [24.9%], and 151 multiracial [6.5%]; 173 Hispanic [7.4%]), 1195 participants (51.2%) reported a sexually transmitted infection history and 1843 participants (78.9%) reported 2 or more male sex partners. Vaccination rates increased from 0 of 371 participants to 330 of 402 participants (82.1%) from 2006 to 2023. Among vaccinated participants, positivity decreased from 93 of 371 participants (27.7%) to 1 of 330 participants (0.4%) for 2vHPV (relative difference, 98.4%), 118 participants (35.4%) to 3 participants (2.1%) for 4vHPV (relative difference, 94.2%), and 163 participants (48.6%) to 21 participants (11.8%) for 9vHPV (relative difference, 75.7%). Among unvaccinated participants, positivity decreased from 93 of 371 participants (25.8%) to 3 of 72 participants (7.3%) for 2vHPV (relative difference, 71.6%), 118 participants (25.3%) to 4 participants (6.1%) for 4vHPV (relative difference, 75.8%), and 163 participants (42.7%) to 13 participants (31.1%) for 9vHPV (relative difference, 27.2%). For positivity rates, counts are raw numbers and percentages are propensity score adjusted. Adjusted logistic regression demonstrated significant reductions in the odds of at least 1 HPV type in the 2vHPV and 4vHPV among all (adjusted odds ratio [aOR], 0.03; 95% CI, 0.01 to 0.07 and aOR, 0.06; 95% CI, 0.03 to 0.10, respectively), vaccinated (aOR, 0.01; 95% CI, <0.01 to 0.05 and aOR, 0.04; 95% CI, 0.02 to 0.08, respectively), and unvaccinated (aOR, 0.23; 95% CI, 0.08 to 0.63 and aOR, 0.19; 95% CI, 0.07 to 0.52, respectively) participants and in the 9vHPV among all (aOR, 0.22; 95% CI 0.16 to 0.31) and vaccinated (aOR, 0.14; 95% CI 0.09 to 0.21) participants. CONCLUSIONS AND RELEVANCE: In this study, population-level effectiveness and herd protection were robust 17 years after HPV vaccine introduction, even in sexually experienced adolescent girls and young women at relatively high risk for HPV who may not have received the full vaccination series.	JAMA pediatrics	29/09/2025
10.1111/bph.70209	Oral administration of low-molecular-weight heparin ameliorates colitis by	Zheng D, Chen S, Feng H, Zhang S, Zhang C, Wang Y, Tan W, Qing Q, Liu L, Liu X, Wang Z, Liang L, Sun J, Chen Y	BACKGROUND AND PURPOSE: Previous studies have reported that oral low-molecular-weight heparin (LMWH) ameliorated colitis by undefined mechanisms in ulcerative colitis (UC) patients. Our study explored the mechanisms of LMWH on colitis from the perspective of gut microbiota and its metabolites. EXPERIMENTAL APPROACH: Dextran sulfate sodium (DSS; 2.5%) was used to induce colitis in mouse model, and LMWH was administered by either oral gavage, intracolonic delivery or subcutaneous injection to compare their therapeutic effects. Pseudo-germ-free mice was established by using antibiotic cocktail, and faecal microbial transplantation (FMT) was performed to verify the role of microbiota in LMWH actions. Alcian blue staining, fluorescence in situ hybridization of EUB338 and immunohistochemical staining were performed to evaluate the integrity of gut mucus barrier. Amplicon sequencing, transcriptome sequencing and untargeted metabolome studies were used to explore LMWH mechanisms. The ameliorating effect of indole-3-propionic acid (IPA) was verified in vitro and in vivo. KEY RESULTS: Oral, but not subcutaneous, administration of LMWH alleviated colitis and enhanced the gut mucus barrier. Pseudo-germ-free mice and FMT assays confirmed that therapeutic effects of oral LMWH were dependent on gut microbiota. Oral LMWH increased Firmicutes abundance and decreased Escherichia/Shigella abundance, subsequently increasing microbial tryptophan metabolites, especially IPA. The protective effects of oral LMWH were reproduced by IPA supplementation, with mucus barrier enhancing through regulating the Wnt/β-catenin pathway. CONCLUSION AND IMPLICATIONS: The results provide new insights into the signalling mechanisms associated with the therapeutic potential of LMWH in colitis, and highlight the application of IPA for UC treatment.	British journal of pharmacology	28/09/2025
10.1016/j.ajcnut.2025.09.036	Associations between Combined Healthy Lifestyle and Adverse Birth Outcomes in Two	Dong Y, Zheng JS, Yang Y, Wang T, Li F, Wu P, Lai Y, Wang Y, He X, Zhang P, Zhang S, Wu N, Li S, Yuan J, Shan D, Liu X, Liu G, Hu Y, Pan A, Pan XF	BACKGROUND: Maternal lifestyle factors are reported to be associated with adverse birth outcomes (ABOs). These factors may also dynamically influence gut microbiota composition and serum metabolic profiles. OBJECTIVE: To investigate the associations between combined healthy lifestyle and ABOs, and the mediating roles of gut microbiota and serum metabolites. METHODS: This study was conducted based on the Tongji-Huaxi-Shuangliu Birth Cohort (THSBC), comprising 1086 participants with repeated multi-omics data collected at three time points. An independent validation was performed using 161 participants from the Huaxi Birth Cohort (HBC), with available multi-omics data at five time points. Participants were classified into three lifestyle categories (unhealthy, low healthy, and highly healthy) according to diet, physical activity, smoking, drinking, sleep, and body mass index. Gut microbiota were characterized using 16S rRNA gene sequencing in the THSBC and metagenomics in the HBC, while serum metabolites were profiled using untargeted liquid chromatography-mass spectrometry. Clinical data on birth outcomes, such as gestational age, birth weight, and sex were collected in the THSBC. RESULTS: A highly healthy lifestyle was associated with lower risks of macrosomia (MAC) (odds ratio: 0.43; 95% confidence interval: 0.33, 0.57), preterm birth (PTB) (0.60; 0.46, 0.79), and large for gestational age (LGA) (0.44; 0.35, 0.56). Among the identified mediators, gut microbiota and serum metabolites, including Eisenbergiella, Tyzzerella, Megamonas, pro-Ile, and 1-amino-1-cyclobutane-carboxylic acid were negatively associated with a healthy lifestyle, while Lachnospiraceae NK4A136 group, 4-methoxyestrone, and LPC (0:0/18:3) were positively associated. Mediation analyses showed that Eisenbergiella and 4-methoxyestrone explained 11.4% and 13.0% of the inverse association between a highly healthy lifestyle and PTB, respectively, while the other microbiota and metabolites mediated 5%-7% of the associations with MAC and LGA. CONCLUSION: Maternal healthy lifestyle was associated with lower risks of ABOs, with gut microbiota and serum metabolites serving as important mediators in these relationships.	The American journal of clinical nutrition	26/09/2025
10.1038/s41467-025-63414-1	Comparison of imaging based single-cell resolution spatial transcriptomics	Ozirmak Lermi N, Molina Ayala M, Hernandez S, Lu W, Khan K, Serrano A, Lubo I, Hamana L, Tomczak K, Barnes S, Dou J, Liang Q, Raso MG, Tang X, Jiang M, Sanchez-Espiridion B, Weissferdt A, Heymach J, Zhang J, Sepesi B, Cascone T, Tsao A, Altan M, Mehran R, Gibbons D, Wistuba I, Haymaker C, Chen K, Solis Soto LM	Imaging-based spatial transcriptomics (ST) is evolving as a pivotal technology in studying tumor biology and associated microenvironments. However, the strengths of the commercially available ST platforms in studying spatial biology have not been systematically evaluated using rigorously controlled experiments. We use serial 5 μm sections of formalin-fixed, paraffin-embedded surgically resected lung adenocarcinoma and pleural mesothelioma samples in tissue microarrays to compare the performance of the ST platforms (CosMx, MERFISH, and Xenium (uni/multi-modal)) in reference to bulk RNA sequencing, multiplex immunofluorescence, GeoMx, and hematoxylin and eosin staining data. In addition to an objective assessment of automatic cell segmentation and phenotyping, we perform a manual phenotyping evaluation to assess pathologically meaningful comparisons between ST platforms. Here, we show the intricate differences between the ST platforms, reveal the importance of parameters such as probe design in determining the data quality, and suggest reliable workflows for accurate spatial profiling and molecular discovery.	Nature communications	26/09/2025
10.4291/wjgp.v16.i3.107573	Fatigue in inflammatory bowel disease: Prevalence, risk factors, assessment,	Giri S, Harindranath S, Kulkarni A, Sahoo JK, Joshi H, Nath P, Sahu MK	Fatigue is a prevalent and often debilitating symptom in individuals with inflammatory bowel disease (IBD), affecting a substantial proportion of patients, even during periods of disease remission. The prevalence of fatigue in IBD remains high, affecting around half of the IBD patients and being more common in patients with active disease than those in remission. Several risk factors contribute to fatigue in IBD, including active disease and pro-inflammatory state, nutritional deficiencies and anemia, sleep disturbances, psychological comorbidities, microbiota changes and the gut-brain axis, muscle dysfunction, sarcopenia, and physical inactivity. Assessing fatigue in IBD is challenging due to its subjective nature and the lack of a uniformly quantifiable method. Fatigue significantly impacts the quality of life, affecting physical functioning, psychological and emotional well-being, and social and relational consequences. The management of fatigue in IBD requires a comprehensive, multidisciplinary approach. This includes addressing disease activity through conventional drug treatment, biologicals and small molecules, and surgical treatment. Psychological interventions such as cognitive behavioral therapy, problem-solving therapy, solution-focused therapy, mindfulness-based cognitive therapy, and brief behavioral therapy have shown promise in improving fatigue. Nutritional interventions, including treating deficiencies and supplementation, and lifestyle interventions, such as physical exercise, aromatherapy, and sleep interventions, are also important components of fatigue management. Pharmacological interventions like modafinil and bupropion may be considered in refractory cases. This review aims to summarize the current evidence on fatigue in IBD, including its prevalence, risk factors, assessment methods, outcomes, and management strategies.	World journal of gastrointestinal pathophysiology	22/09/2025
10.1186/s40001-025-03147-5	Machine learning and nomogram prediction model to explore the relationship	Zou L, Zhao J, Ruan Y, Wang Y	BACKGROUND: Asthma is a prevalent chronic respiratory disease with significant morbidity and healthcare burden. Identifying novel biomarkers for asthma risk prediction is crucial for early intervention and personalized management. The monocyte-to-high-density lipoprotein cholesterol ratio (MHR) has emerged as a potential inflammatory marker in various chronic diseases. This study aimed to investigate the association between MHR and asthma risk using data from the National Health and Nutrition Examination Survey (NHANES) and to develop a predictive model for asthma risk incorporating MHR and other clinical variables. METHODS: Data from NHANES (2001-2018) were used. Weighted logistic regression was employed to assess the relationship between MHR and asthma risk. Participants were randomly divided into training (70%) and validation (30%) cohorts. The Boruta algorithm was used to evaluate the training cohort, select the best model, and identify potential confounding factors. A nomogram-based predictive model was constructed using variables selected by the Boruta algorithm [smoke, age, hypertension, cardiovascular disease (CVD), marital status, gender, race, poverty-income ratio (PIR), body mass index (BMI), cancer, education, diabetes, and MHR]. The model's performance was evaluated using receiver operating characteristic (ROC) curves, calibration curves, and decision curve analysis (DCA) curves. The variables selected by Boruta algorithm are included in the machine learning (ML) model for analysis. SHAP (SHapley Additive exPlanations) analysis was performed to assess the contribution of each variable. RESULTS: A total of 28,855 participants were included after excluding those with missing data. MHR was positively associated with asthma incidence (P < 0.05). The Boruta algorithm achieved an AUC of 0.64 in the validation cohort. Among the ML models, the Xgboost model demonstrated the best performance with an AUC of 0.640 (95% CI 0.623-0.656). SHAP analysis identified CVD as the most influential factor, followed by age, BMI, PIR, and gender. CONCLUSIONS: This study demonstrates a positive association between the MHR and asthma risk, indicating a significant cross-sectional relationship. The nomogram-based predictive model incorporating MHR and other clinical variables showed moderate discriminative ability.	European journal of medical research	26/09/2025
