DOI	Title	Authors	Abstract	Journal	Date
10.1001/jamainternmed.2025.4917	The Rise in Early-Onset Cancer in the US Population-More Apparent Than Real.	Patel VR, Adamson AS, Welch HG	IMPORTANCE: Rising rates of early-onset cancer have generated substantial media coverage and public concern. In response, early-onset cancer has become a federal research priority, and clinical guidelines have shifted to recommend earlier screening for some cancers. Yet, it remains unclear whether rising rates represent a true increase in cancer occurrence or that these may instead be explained by increased diagnostic scrutiny. OBSERVATIONS: In aggregate, the 8 cancers with the fastest-rising incidence (>1% per year) in US adults younger than 50 years (thyroid, anus, kidney, small intestine, colorectum, endometrium, pancreas, and myeloma) have doubled in incidence since 1992, while the aggregate mortality for these cancers has remained flat. Colorectal and endometrial cancer showed a slight rise in mortality; for the others, stable or declining mortality alongside rising diagnoses suggests that greater detection (rather than more disease) accounts for the trend. In some cancers, such as thyroid and kidney cancer, overdiagnosis is well documented. For others, incidental detection or earlier diagnosis may explain the trends. While not among the fastest growing (0.6% per year), breast cancer remains the most common early-onset cancer, and despite rising diagnoses in women younger than 50 years, mortality has decreased by approximately half. CONCLUSIONS AND RELEVANCE: The rise in early-onset cancer incidence does not consistently signal a rise in the occurrence of clinically meaningful cancer. While some of the increase in early-onset cancer is likely clinically meaningful, it appears small and limited to a few cancer sites. Much of the increase appears to reflect increased diagnostic scrutiny and overdiagnosis. Interpreting rising incidence as an epidemic of disease may lead to unnecessary screening and treatment while also diverting attention from other more pressing health threats in young adults.	JAMA internal medicine	29/09/2025
10.13201/j.issn.1001-1781.2018.04.006	[Therapeutic effects of psychological intervention combined with manual reduction	Wang X, Tian YJ, Shan J	Objective:To explore the best treatment for elderly patients with benign paroxysmal positional vertigo (BPPV). Method:Sixty-eight BPPV patients aged 60-85 years were randomly divided into two groups. The control group was treated by simple manipulation. The study group was treated by manual reduction combined with psychological intervention. The curative effect was compared. Result:The cure rates of the control group and the study group were 44.4% and 43.8% respectively, with no significant difference (P>0.05); the effective rates were 52.78% and 87.50% respectively, with significant difference (P<0.05). The recurrence rates of control group and study group were 8.3% and 3.1% after 2 weeks of treatment, respectively, with no significant difference (P>0.05). The recurrence rates at 3 months were 5.6% and 0 respectively, with no significant difference (P>0.05). The difference of SAS and SDS between the two groups after treatment was statistically significant (P<0.05). There was no significant difference in the residual symptoms between the two groups at the first follow-up (P>0.05), and at 1 week and 4 weeks (P<0.05). The residual symptoms of the patients after reoperation were relieved compared with those of the control group. The DHI scores of the study group between 60-70 years old and 71-85 years old group for the first time, after 1 week and 4 weeks were statistically significant (P<0.05), and the residual symptoms in the 60-70 years group were reduced compare to the 71-85-year-old group. Conclusion:Elderly people with BPPV are susceptible to anxiety and depression. Manipulation combined with psychological intervention can promote the curative effect well, but personalized treatment plan should be developed.	Lin chuang er bi yan hou tou jing wai ke za zhi = Journal of clinical	01/02/2018
10.1007/s00415-025-13374-9	Cognitive stimulation in Parkinson's disease with mild cognitive impairment.	Buonocore J, Iaccino N, Torchia G, Curcio F, Pirrotta FM, Contrada M, Pucci C, Gambardella A, Quattrone A, Pilotto A, Pignolo L, Arabia G	BACKGROUND: Cognitive impairment is among the most frequent and disabling non-motor symptoms of Parkinson's disease (PD), often emerging early and substantially impacting autonomy and quality of life. While cognitive stimulation (CS) is supported in other neurodegenerative conditions, its role in PD is less explored. This study aimed to compare the efficacy of a therapist-guided, home-based CS program, delivered via a virtual reality rehabilitation system, with a conventional in-person CS intervention. METHODS: Of 123 individuals screened, 45 patients with PD and mild cognitive impairment (PD-MCI) were randomized to either the tele-rehabilitation group (TRG; n = 25) or the control group (CG; n = 20). Both groups received the same standardized 4-week CS program (20 multi-domain sessions, 5 days/week), targeting memory, attention, executive functions, language, and visuospatial skills. The TRG trained at home via the VRRS platform under remote supervision, while the CG attended outpatient sessions. Neuropsychological and clinical outcomes were assessed at baseline (T1), post-intervention (T2), and 6-month follow-up (T3). Analyses included repeated-measures ANOVA, multivariate linear regression, and categorical comparisons based on predefined clinical cut-offs. RESULTS: All participants completed the intervention with adherence exceeding 90% in both groups. At T2, the TRG showed greater improvements than the CG in global cognition, working memory, and delayed recall. These effects remained significant after adjusting for age, sex, baseline performance, and cognitive reserve index, and were robust to false discovery rate correction. Regression models confirmed these improvements. Categorical analyses also showed a marked reduction in pathological scores in the TRG in the same domains. CONCLUSION: A short-term, therapist-guided CS program delivered via tele-rehabilitation effectively improved cognitive functioning in PD-MCI, with partial benefits maintained at 6 months, especially in memory and executive domains. The intervention was particularly beneficial for memory and executive functions, highlighting telemedicine as a promising and accessible option for cognitive care in PD.	Journal of neurology	27/09/2025
10.1038/s41366-025-01920-4	Effects of tirzepatide on weight management in patients with and without	Cerchi E, Santo PADE, de Oliveira MC, Janovsky CCPS, Halpern B	AIMS: To conduct a systematic review and meta-analysis comparing tirzepatide versus placebo for weight management, with analyses stratified by diabetes status to precisely assess its efficacy and safety in individuals with and without diabetes. METHODS: We systematically searched MEDLINE, Embase, and Cochrane Library for randomized controlled trials comparing once-weekly tirzepatide (5-15 mg) versus placebo in adults with or without diabetes for at least 26 weeks. For each subpopulation analysis, the random-effects model was used to calculate pooled risk ratios (RRs) and mean differences (MDs), with their 95% confidence intervals, for dichotomous and continuous endpoints, respectively. Statistical significance was considered at p < 0.05. RESULTS: We included five trials (n = 2,174) in patients with diabetes (BMI ≥ 23 kg/m(2)) and five (n = 4,467) in patients without diabetes (BMI ≥ 27 [≥24 in Asia] kg/m(2)). Compared with placebo, tirzepatide led to significantly greater relative and absolute weight reductions in patients with (RR -9.54%, p < 0.01; MD -9.06 kg, p < 0.01) and without diabetes (RR -17.15%, p < 0.01; MD -18.11 kg, p < 0.01). In both subpopulations, tirzepatide also significantly increased the probability of achieving weight reductions of ≥5%, ≥10%, and ≥15%, as well as improved BMI, waist circumference, blood pressure, hemoglobin A1c, and lipid levels. Notably, weight-related benefits with tirzepatide were significantly greater in patients without diabetes, whereas its safety was similar across subpopulations and predominantly consisted of mild to moderate, well-tolerated adverse events. CONCLUSIONS: Compared with placebo, tirzepatide resulted in statistically significant and clinically meaningful weight reduction, especially in patients without diabetes (with overweight/obesity), with an acceptable safety profile.	International journal of obesity (2005)	27/09/2025
10.1111/acel.70233	Age-Associated Transcriptomic and Epigenetic Alterations in Mouse Hippocampus.	Bilgic M, Obata R, Panfil VI, Zhu Z, Saeki M, Gotoh Y, Kishi Y	Aging represents a major risk for human neurodegenerative disorders, such as dementia and Alzheimer's disease, and is associated with a functional decline in neurons and impaired synaptic plasticity, leading to a gradual decline in memory. Previous research has identified molecular and functional changes associated with aging through transcriptomic studies and neuronal excitability measurements, while the role of chromatin-level regulation in vulnerability to aging-related diseases is not well understood. Moreover, the causal relationship between molecular alterations and aging-associated decline in functions of different cell types remains poorly understood. Here, we systematically characterized gene regulatory networks in a cell type-specific manner in the aging mouse hippocampus, a central brain region involved in learning and memory formation, by simultaneously profiling gene expression and chromatin accessibility at a single-nucleus level. The analysis of multiome (RNA and ATAC) sequencing recapitulated the diversity of glial and neuronal cell types in the hippocampus and revealed transcriptomic and chromatin accessibility level changes in different cell types, among which oligodendrocytes and dentate gyrus (DG) neurons exhibited the most drastic changes. We found pronounced aging-dependent chromatin-level changes among neurons, especially for genes related to synaptic plasticity. Our data suggest that BACH2, a candidate transcription factor implicated in aging-mediated functional decline of DG neurons, potentially regulates genes associated with synaptic plasticity, cell death, and inflammation during aging. Taken together, our single-nucleus multiome analysis reveals potential cell type-specific regulators involved in the aging of neurons and glial cells.	Aging cell	28/09/2025
10.1016/j.jep.2025.120641	Shaoyao decoction promotes ISCs proliferation by activating Wnt/β-catenin and	Yang R, Han L, Zhang Y, Dong J, Ma Q, Hua Y, Ji P, Yao W, Yuan Z, Wei Y	ETHNOPHARMACOLOGICAL RELEVANCE: Shaoyao decoction (SYD) is a classic traditional Chinese medicine formulation that presented a significant therapeutic effect on damp-heat colitis. However, its potential pharmacological mechanisms remain not fully elucidated. AIM OF THE STUDY: This study aimed to investigate the effect of SYD on intestinal epithelial regeneration by analyzing the activity of intestinal stem cells (ISCs) in a mouse model of damp-heat colitis. MATERIALS AND METHODS:	Journal of ethnopharmacology	25/09/2025
10.1186/s12933-025-02921-3	Association of the triglyceride-glucose index combined with a body shape index	Chen M, Guo J, Shangguan Y, Sun Z, He X, Tu Q, Yan Q	BACKGROUND: The triglyceride-glucose (TyG) index, as a measure of insulin resistance, has been confirmed to be associated with adverse clinical outcomes. The new composite indicator, TyG-A body type index (TyG-ABSI), by integrating the TyG index and the A body type index, has demonstrated superior efficacy in predicting the risk of cardiovascular death in the general population compared to traditional indicators. This study aims to deeply explore the association between TyG-ABSI and all-cause mortality and CVD mortality in the population with cardiovascular kidney-metabolic syndrome (CKM) stages 0-3. The analysis will be conducted from multiple dimensions such as the intensity of indicator correlation and potential influencing mechanisms, in order to comprehensively reveal the relationship between the two. RESULTS: We analyzed data from 13,480 participants in the NHANES cohort (1999-2018) using Cox proportional hazards models and restricted cubic spline functions. The results indicated that elevated TyG-ABSI values were independently associated with a higher risk of all-cause mortality (HR = 1.226, 95% CI 1.104-1.361) and cardiovascular mortality (HR = 1.377, 95% CI 1.149-1.651). Time-dependent receiver operating characteristic (ROC) curves and concordance index evaluations demonstrated that TyG-ABSI yielded more accurate long-term prognostic performance than other TyG-derived metrics. The area under the curve (AUC) of this indicator reached 0.688-0.708 in the prediction of all-cause mortality risk over 5-15 years, and 0.696-0.739 in the prediction of cardiovascular mortality risk. External validation using CHARLS data confirmed the robustness of these findings in predicting all-cause mortality. CONCLUSIONS: Among individuals with CKM stages 0-3, TyG-ABSI demonstrates a stronger association with mortality risk and superior predictive ability compared with other TyG-derived metrics. Its performance suggests a potential role in capturing variations across diverse clinical subgroups, and informing optimal timing for preventive interventions.	Cardiovascular diabetology	23/09/2025
10.1016/j.clcc.2016.02.004	A Plasma-Based Protein Marker Panel for Colorectal Cancer Detection Identified by	Jones JJ, Wilcox BE, Benz RW, Babbar N, Boragine G, Burrell T, Christie EB, Croner LJ, Cun P, Dillon R, Kairs SN, Kao A, Preston R, Schreckengaust SR, Skor H, Smith WF, You J, Hillis WD, Agus DB, Blume JE	INTRODUCTION: Colorectal cancer (CRC) testing programs reduce mortality; however, approximately 40% of the recommended population who should undergo CRC testing does not. Early colon cancer detection in patient populations ineligible for testing, such as the elderly or those with significant comorbidities, could have clinical benefit. Despite many attempts to identify individual protein markers of this disease, little progress has been made. Targeted mass spectrometry, using multiple reaction monitoring (MRM) technology, enables the simultaneous assessment of groups of candidates for improved detection performance. MATERIALS AND METHODS: A multiplex assay was developed for 187 candidate marker proteins, using 337 peptides monitored through 674 simultaneously measured MRM transitions in a 30-minute liquid chromatography-mass spectrometry analysis of immunodepleted blood plasma. To evaluate the combined candidate marker performance, the present study used 274 individual patient blood plasma samples, 137 with biopsy-confirmed colorectal cancer and 137 age- and gender-matched controls. Using 2 well-matched platforms running 5 days each week, all 274 samples were analyzed in 52 days. RESULTS: Using one half of the data as a discovery set (69 disease cases and 69 control cases), the elastic net feature selection and random forest classifier assembly were used in cross-validation to identify a 15-transition classifier. The mean training receiver operating characteristic area under the curve was 0.82. After final classifier assembly using the entire discovery set, the 136-sample (68 disease cases and 68 control cases) validation set was evaluated. The validation area under the curve was 0.91. At the point of maximum accuracy (84%), the sensitivity was 87% and the specificity was 81%. CONCLUSION: These results have demonstrated the ability of simultaneous assessment of candidate marker proteins using high-multiplex, targeted-mass spectrometry to identify a subset group of CRC markers with significant and meaningful performance.	Clinical colorectal cancer	01/06/2016
10.3881/j.issn.1000-503X.2014.01.021	[Roles of microRNAs in allergic airway diseases].	Teng YS, Cao XL, Li Y	The microRNAs (miRNAs/miRs) are a class of short non-coding RNAs regulating protein translation via mRNAs silencing. Studies have shown that microRNAs play critical roles in allergic diseases, tumors, and infections. The allergic airway diseases are characterized by inflammation and hyperresponsiveness of the respiratory tract. Several miRNAs are found to be involved in a series of pathophysiologic processes in allergic airway diseases including inflammatory cells infiltration, cytokines' expressions, airway hyperresponsiveness, and proliferation and change in phenotype of smooth muscle cells. Therefore, miRNAs may be new therapeutic targets for these allgeric diseases. This article reviews the roles of miRNAs in asthma and allergic rhinitis and their molecular biological mechanisms.	Zhongguo yi xue ke xue yuan xue bao. Acta Academiae Medicinae Sinicae	01/02/2014
10.1016/S1474-4422(25)00270-4	Diagnosis of multiple sclerosis: 2024 revisions of the McDonald criteria.	Montalban X, Lebrun-Frénay C, Oh J, Arrambide G, Moccia M, Pia Amato M, Amezcua L, Banwell B, Bar-Or A, Barkhof F, Butzkueven H, Ciccarelli O, Chataway J, Cohen JA, Comi G, Correale J, Deisenhammer F, Filippi M, Fiol J, Freedman MS, Fujihara K, Granziera C, Green AJ, Hartung HP, Hellwig K, Kappos L, Kimbrough D, Killestein J, Lublin F, Marignier R, Ann Marrie R, Miller A, Otero-Romero S, Ontaneda D, Ramanathan S, Reich D, Rocca MA, Rovira À, Saidha S, Salter A, Sastre-Garriga J, Saylor D, Solomon AJ, Sormani MP, Stankoff B, Tintore M, Tremlett H, Van der Walt A, Viswanathan S, Wiendl H, Wildemann B, Yamout B, Zaratin P, Calabresi PA, Coetzee T, Thompson AJ	Advances in the understanding of multiple sclerosis and the development of biomarkers of pathophysiology prompted a substantial revision of the 2017 McDonald diagnostic criteria. The new 2024 McDonald criteria provide a unified approach for diagnosing multiple sclerosis in individuals with relapsing or progressive courses throughout the lifespan (ie, from paediatric to late-life presentations). The optic nerve can now serve as a fifth anatomical location within the CNS for diagnosis. The central vein sign, paramagnetic rim lesions, and kappa free-light chain concentrations in CSF can be used, when available, to provide supportive evidence and confer specificity for a diagnosis of multiple sclerosis in specific situations. In certain cases, radiologically isolated syndrome or neurological symptoms that do not constitute a clear attack or progression of disability can fulfil the criteria for a multiple sclerosis diagnosis. We also provide guidance for the diagnosis of multiple sclerosis in older individuals (≥50 years) and those with comorbidities. The 2024 revised criteria should expedite the diagnosis of multiple sclerosis, while maintaining specificity.	The Lancet. Neurology	01/10/2025
10.1186/s12984-025-01738-1	Effects of intermittent theta-burst stimulation on cognition and glymphatic	Yang CC, Huang KY, Hsu JL, Hu CJ, Lu YH, Kuan YC	BACKGROUND: Repetitive transcranial magnetic stimulation (rTMS) has demonstrated efficacy in alleviating cognitive symptoms in Alzheimer's disease (AD) and mild cognitive impairment (MCI). Although animal studies suggest rTMS may enhance glymphatic system efficiency and reduce amyloid deposits, its impact on human glymphatic activity remains uncertain. METHODS: This double-blind, randomized, sham-controlled trial investigated the effects of intermittent theta-burst stimulation (iTBS), a novel rTMS technique, on cognitive function and glymphatic system activity using diffusion tensor image analysis along the perivascular space (DTI-ALPS) in 52 participants with amnestic MCI or very mild AD. Participants underwent 10 sessions of iTBS targeting the left dorsolateral prefrontal cortex over two weeks. Cognitive and glymphatic assessments were conducted at baseline, week 2, and week 6. Of the 52 participants, 28 received active iTBS, while 24 received sham stimulation. After the first two weeks, the sham group transitioned to active iTBS. RESULTS: Significant cognitive improvements were observed at week 6 in the iTBS group, indicating delayed cognitive enhancement, though no immediate changes in cognition or glymphatic system activity (measured by the ALPS index) were observed. No adverse events were reported. CONCLUSIONS: These findings suggest that iTBS can produce delayed cognitive enhancement in individuals with amnestic MCI and very mild AD, while the impact on the glymphatic system remains uncertain and requires further investigation. TRIAL REGISTRATION: Clinicaltrials.gov (NCT04555941).	Journal of neuroengineering and rehabilitation	26/09/2025
10.3390/ijms21030969	Precision Psychiatry Applications with Pharmacogenomics: Artificial Intelligence	Lin E, Lin CH, Lane HY	A growing body of evidence now suggests that precision psychiatry, an interdisciplinary field of psychiatry, precision medicine, and pharmacogenomics, serves as an indispensable foundation of medical practices by offering the accurate medication with the accurate dose at the accurate time to patients with psychiatric disorders. In light of the latest advancements in artificial intelligence and machine learning techniques, numerous biomarkers and genetic loci associated with psychiatric diseases and relevant treatments are being discovered in precision psychiatry research by employing neuroimaging and multi-omics. In this review, we focus on the latest developments for precision psychiatry research using artificial intelligence and machine learning approaches, such as deep learning and neural network algorithms, together with multi-omics and neuroimaging data. Firstly, we review precision psychiatry and pharmacogenomics studies that leverage various artificial intelligence and machine learning techniques to assess treatment prediction, prognosis prediction, diagnosis prediction, and the detection of potential biomarkers. In addition, we describe potential biomarkers and genetic loci that have been discovered to be associated with psychiatric diseases and relevant treatments. Moreover, we outline the limitations in regard to the previous precision psychiatry and pharmacogenomics studies. Finally, we present a discussion of directions and challenges for future research.	International journal of molecular sciences	1/02/2020
10.1158/1940-6207.CAPR-09-0165	The detection of chromosomal aneusomy by fluorescence in situ hybridization in	Varella-Garcia M, Schulte AP, Wolf HJ, Feser WJ, Zeng C, Braudrick S, Yin X, Hirsch FR, Kennedy TC, Keith RL, Barón AE, Belinsky SA, Miller YE, Byers T, Franklin WA	Lung cancer usually is disseminated (advanced) and has a poor prognosis at diagnosis. Current and former smokers are at a high risk for lung cancer and are candidates for prevention and early detection strategies. Sputum is a potential source of biomarkers that might determine either lung cancer risk or the presence of early lung cancer, but no current sputum test is sufficiently sensitive and specific for effective screening. We used fluorescence in situ hybridization (FISH) to measure chromosomal aneusomy (CA) in sputum samples collected prospectively from 100 incident lung cancer cases and 96 controls (matched on age, gender, and date of collection) nested within an ongoing high-risk cohort. The CA-FISH assay was aimed at four DNA targets: epidermal growth factor receptor, MYC, 5p15, and CEP 6. The sensitivity of a positive CA-FISH assay (abnormal for two or more of the four markers) for lung cancer was substantially higher for samples collected within 18 months (76% sensitivity) than for samples collected more than 18 months (31%) before lung cancer diagnosis. Sensitivity was higher for squamous cell cancers (94%) than for other histologic types (69%).	Cancer prevention research (Philadelphia, Pa.)	01/04/2010
