DOI,Title,Authors,Abstract,Journal,Date
10.1016/j.cell.2025.08.038,multiscale proteomic modeling reveal protein network drive alzheimer 's,"Wang E, Yu K, Cao J, Wang M, Katsel P, Song WM, Wang Z, Li Y, Wang X, Wang Q, Xu P, Yu G, Zhu L, Geng J, Habibi P, Qian L, Tuck T, Li A, Tcw J, Roussos P, Brennand KJ, Haroutunian V, Johnson ECB, Seyfried NT, Levey AI, Bennett DA, Peng J, Cai D, Zhang B",molecular mechanism underlie pathogenesis alzheimer 's disease ad most common form dementia remain poorly understand proteomic offer crucial approach elucidate ad pathogenesis alteration protein expression be more directly link phenotypic outcome change genetic transcriptomic level study develop multiscale proteomic network model ad integrate large scale match proteomic genetic datum brain region vulnerable disease model reveal detailed protein interaction structure identify putative key driver protein kdp involve ad progression notably network analysis uncover,Cell,2025 Sep 25
10.1016/j.ccell.2025.09.003,sensory neuron drive pancreatic cancer progression glutamatergic,"Ren L, Liu C, Çifcibaşı K, Ballmann M, Rammes G, Mota Reyes C, Tokalov S, Klingl A, Grünert J, Goyal K, Neckel PH, Mattheus U, Schoeps B, Yıldızhan SE, Sezerman OU, Cevik NC, Sever EA, Karakas D, Safak O, Steiger K, Muckenhuber A, Görgülü K, Chen Z, Zhang J, Ye L, Maula Ali MI, Tiwari VK, Romanyuk N, Giesert F, Saur D, Rad R, Schmid RM, Algül H, Krüger A, Friess H, Ceyhan GO, Istvanffy R, Demir IE",cancer thrive neuronal input here demonstrate presence pseudo synaptic connection sensory nerve ending cancer cell extracerebral cancer i.e. pancreatic ductal adenocarcinoma pdac synaptic site exhibit selective enrichment glutamatergic n methyl d aspartate receptor nmda receptor subunit nmdar2d grin2d cancer cell turn pdac cell responsive neuron derive glutamate promote tumor growth spread intriguingly neuron transform subset co cultured pdac cell calcium responsive cell grin2d type glutamate receptor neuron cancer pseudo synapsis find expression subunit be due increase glutamate availability provide sensory innervation neurotrophic feedforward loop moreover interference glutamate grin2d signal neuron cancer pseudo synapsis markedly improve survival vivo discovery peripheral cancer neuron pseudo synapsis may provide opportunity cancer neuroscience instruct oncological therapy,Cancer cell,2025 Sep 25
10.1016/j.ccell.2025.09.002,ketogenic diet inhibit glioma progression promote gut microbiota derive,"Chen ML, He Y, Dong XH, Liu HF, Yan ZX, Lu XL, Miao QQ, Zhao QN, Zhang H, Luo L, Wang S, Li JY, Xiang DF, Lin Y, Li TR, Zhou XY, Zhou YY, Mao M, Zhang X, Wei H, Shi Y, Liu XD, Ping YF, Bian XW",ketogenic diet kd be potential therapeutic strategy glioma however underlie mechanism remain unclear herein first identify glioma patient exhibit distinct gut microbial profile characterize reduce butyrate produce bacteria abundance particularly r. faecis decrease butyrate level notably kd reshape gut microbiota especially enrich a. muciniphila mucin-2 dependent manner elevate butyrate production activate caspase-3 microglia change promote anti tumor microglial phenotype ultimately suppress glioma progression mouse crucially kd 's anti glioma effect be notably abolish antibiotic treatment germ free condition specific depletion mucin-2 microglia microglial caspase-3 furthermore butyrate a. muciniphila r. faecis a. muciniphila r. faecis restore kd induce microglial caspase-3 activation anti tumor phenotype microglia antibiotic treat germ free mouse finding highlight target gut microbiota kd supplement butyrate could be effective strategy glioma therapy,Cancer cell,2025 Sep 25
10.1016/j.cmet.2025.09.001,catenibacteriummitsuokai promote hepatocellular carcinogenesis bind,"Zhang Y, Liu W, Wong CC, Song Q, Zhang X, Zhou Q, Ren X, Ren X, Xuan R, Zhao Y, Xu L, Li X, Xu L, Zhang X, Kuang M, Yu J",role gut microbe pathogenesis hepatocellular carcinoma hcc remain unclear here identify catenibacterium be enrich fece tumor patient hcc c. mitsuokai accelerate hcc carcinogenesis conventional germ free mouse furthermore c. mitsuokai disrupt gut barrier translocate liver live bacteria critically c. mitsuokai surface protein gtr1 raga interact γ catenin receptor hcc cell facilitate attachment colonization mouse liver far reveal pro tumorigenic effect c. mitsuokai depend secrete metabolite quinolinic acid mechanistically quinolinic acid bind activate tyrosine kinase immunoglobulin epidermal growth factor homology domain 2 tie2 hcc cell phosphorylate tie2 subsequently activate downstream oncogenic phosphatidylinositol 3 kinase protein kinase b pi3k akt pathway thereby promote hcc progression summary c. mitsuokai disrupt gut barrier colonize hcc cell gtr1 raga γ catenin secrete quinolinic acid bind tie2 drive pi3k akt pathway to promote hcc development,Cell metabolism,2025 Sep 25
10.1016/j.chroma.2018.01.015,profiling polyunsaturated fatty acid human serum use off line,"Gu WY, Liu MX, Sun BQ, Guo MQ, Wu JL, Li N",polyunsaturated fatty acid pufa play pivotal role biological effect be potential biomarker disease however structural diversity similarity low concentration interference high abundant endogenous component challenge pufas profiling herein novel analytical approach line line solid phase extraction nano liquid chromatography quadrupole time flight mass spectrometry line line spe nano lc q tof ms be establish to monitor pufa combination line line spe remove most impurity recovery range 80.1 93.0 matrix effect be 85.1 to 92.8 use method 51 pufa could be separate well quantify limit quantification 0.006 2.2 pg finally develop method be apply successfully to simultaneously qualify quantify potential biomarker allergic patient 21 pufa include ltb(4 5s- 11s- 15s hete 15s hepe show significant difference study indicate establish method have potential to sensitively accurately determine pufa biological sample,Journal of chromatography. A,2018 Feb 16
10.1016/j.cell.2018.05.051,common disease be more complex imply core gene omnigenic model,"Wray NR, Wijmenga C, Sullivan PF, Yang J, Visscher PM",evidence most adult onset common disease have polygenic genetic architecture fully consistent robust biological system support multiple back mechanism be now overwhelming context consider recent omnigenic core gene model key assumption model be be relatively small number core gene relevant disease intuitively appealing model may underestimate biological complexity common disease therefore goal to discover core gene should not guide experimental design consider other implication polygenicity conclude focus patient stratification be need to achieve goal precision medicine,Cell,2018 Jun 14
10.1111/sjop.12866,relation resilience personality trait role hopelessness,"Nieto M, Visier ME, Silvestre IN, Navarro B, Serrano JP, Martínez-Vizcaíno V",resilience refer process individual use ability to cope challenge to successfully adapt adverse situation incline future hope main aim study be to analyze relation resilience personality trait hopelessness furthermore conduct comparison two age group young old adult sample comprise 439 spanish participant 66.7 woman m = 43.73 sd = 26.41 age range = 18 98 year connor davidson resilience scale neo five factor inventory beck hopelessness scale be use to measure main study variable result reveal negative relation resilience neuroticism positive association other personality trait additionally level resilience be find to be negatively relate hopelessness group old adult show significantly low resilience level young adult age be not significant predictor resilience neuroticism extraversion openness hopelessness be only predictor resilience current study work contribute study resilience related factor attempt to understand role resilience resistance risk individual tackle challenge time important implication mental health,Scandinavian journal of psychology,2023 Feb
10.1186/s40364-025-00831-w,1 year risk cancer associate covid-19 vaccination large,"Kim HJ, Kim MH, Choi MG, Chun EM","oncogenic potential sars cov-2 have be hypothetically propose real world datum covid-19 infection vaccination be insufficient therefore large scale population base retrospective study seoul south korea aim to estimate cumulative incidence subsequent risk overall cancer 1 year covid-19 vaccination datum 8,407,849 individual 2021 2023 be obtain korean national health insurance database participant be categorize two group base covid-19 vaccination status risk overall cancer be assess use multivariable cox proportional hazard model datum be express hazard ratio hrs 95 confidence interval ci hrs thyroid hr 1.351 95 ci 1.206 1.514 gastric hr 1.335 95 ci 1.130 1.576 colorectal hr 1.283 95 ci 1.122 1.468 lung hr 1.533 95 ci 1.254 1.874 breast hr 1.197 95 ci 1.069 1.340 prostate hr 1.687 95 ci 1.348 2.111 cancer significantly increase 1 year post vaccination term vaccine type cdna vaccine be associate increase risk thyroid gastric colorectal lung prostate cancer mrna vaccine be link increase risk thyroid colorectal lung breast cancer heterologous vaccination be relate increase risk thyroid breast cancer give observed association covid-19 vaccination cancer incidence age sex vaccine type further research be need to determine specific vaccination strategy may be optimal population need covid-19 vaccination",Biomarker research,2025 Sep 26
10.1111/ppe.12615,acetaminophen use pregnancy risk attention deficit,"Masarwa R, Platt RW, Filion KB",background association acetaminophen use pregnancy development attention deficit hyperactivity disorder adhd offspring may be due to bias objective primary objective be to assess role potential unmeasured confound estimation association acetaminophen use pregnancy risk adhd bias analysis secondary objective be to assess role selection bias exposure misclassification data source search medline embase scopus cochrane library december 2018 study selection data extraction include observational study examine association acetaminophen use pregnancy risk adhd synthesis meta analyse datum study use random effect model conduct bias analysis study do not adjust important confounder to explore systematic error relate unmeasured confounding selection bias exposure misclassification result search result seven study include meta analysis adjusted estimate be pool study risk ratio rr adhd be 1.35 95 confidence interval ci 1.25 1.46 i(2 = 48 sensitivity analysis unmeasured confound meta analysis show confounder 1.69 rr scale would reduce 10 proportion study true effect size rr > 1.10 unmeasured confound bias analysis decrease point estimate five seven study increase two study suggest observed association could be confound parental adhd unadjusted bias correct risk ratio bcrrs be rr = 1.34 bcrr = 1.13 rr = 1.51 bcrr = 1.17 rr = 1.63 bcrr = 1.38 rr = 1.44 bcrr = 1.17 rr = 1.16 bcrr = 1.18 rr = 1.25 bcrr = 1.05 rr = 0.99 bcrr = 1.18 conclusion bias analysis suggest previously report association acetaminophen use pregnancy increase risk adhd offspring may be due unmeasured confounding ability to conclude causal association be limited,Paediatric and perinatal epidemiology,2020 May
10.1016/j.cell.2025.09.001,safe immunosuppression resistant pan cancer immunotherapeutic velcro like,"Zhou RW, Purohit PK, Kim JH, Lee SU, Burshteyn N, Tifrea D, Cordon A, Grigorian A, Newton BL, Edwards RA, Demetriou M","bispecific antibodie chimeric antigen receptor t cell be most potent cancer immunotherapeutic clinical use most cancer remain poorly targetable high affinity antibody require to maximize kill detect low antigen expression normal tissue risk target cancer toxicity compel identification cancer restrict cell surface protein antigen be rare tumor associate carbohydrate antigen taca be most abundant widespread cancer antigen know be poorly targetable antibody here describe glycan dependent t cell recruiter glytr pan cancer immunotherapeutic utilize high avidity velcro like lectin bind to kill cell high not low taca expression glytr1 glytr2 bind immunosuppressive β1,6glcnac branch n glycan multiple taca tn sialyl tn lacdinac gd2 respectively overcome immunosuppressive mechanism tumor microenvironment trigger target density dependent t cell mediate pan cancer killing lack toxicity mouse human like taca expression density dependent lectin bind taca provide highly potent safe pan cancer immunotherapeutic",Cell,2025 Sep 25
10.1016/j.jare.2025.09.039,global regional national burden cardiovascular disease,"Xu S, Jia S, Yang S, Li D, Zhang E, Lei F, Zeng ML, Lin L",background cardiovascular disease cvds remain lead cause morbidity mortality worldwide postmenopausal woman physiological change hormonal transition accelerate cardiovascular risk yet global sex specific evidence group remain limited understand burden be essential to address biological vulnerability structural inequity aim review review provide first comprehensive global regional national assessment cvd burden woman aged ≥ 55 year 1990 2021 project trend 2040 synthesize epidemiological pattern socio demographic disparity major modifiable risk factor goal inform gender sensitive equity orient cardiovascular prevention policy strategy key scientific concepts review datum be obtain global burden disease gbd study 2021 encompass 204 country territory incidence prevalence mortality disability adjust life year daly be analyze use age standardize rate asr temporal trend be quantify estimate annual percentage change eapc decomposition analysis identify demographic population growth aging epidemiological contribution inequality be evaluate use slope concentration index socio demographic index sdi level bayesian age period cohort model be apply to forecast cvd burden 2040 key finding indicate asir asmr decline globally absolute cvd case death nearly double due demographic expansion disparity widen high sdi region achieve steep reduction low sdi region show slow progress worsen trend ischemic heart disease stroke remain dominant contributor endocarditis be fast rise subtype high systolic blood pressure consistently emerge lead modifiable risk factor collectively finding highlight grow uneven burden cvd postmenopausal woman strengthen hypertension control integrated prevention strategy investment primary healthcare particularly low sdi setting be urgently need review provide woman center evidence base to support equitable cardiovascular health policy resource allocation,Journal of advanced research,2025 Sep 24
10.1016/j.cell.2025.09.003,single cell nascent transcription reveal sparse genome usage plasticity,"Ma S, Hong Y, Chen J, Xu J, Shen X",understand cell diversification common genome metazoan require single cell transcriptional analysis introduce single cell full length,Cell,2025 Sep 26
10.1186/s13045-025-01739-6,combination immunotherapy hepatocellular carcinoma synergy immune,"Dai S, Chen Y, Cai W, Dong S, Zhao J, Chen L, Cheng CS",combination therapy be rapidly become cornerstone hepatocellular carcinoma hcc treatment immune checkpoint inhibitor ici have emerge central strategy systemic therapy efficacy monotherapie remain limited consequently combinatorial approach such icis tyrosine kinase inhibitor tkis icis chemotherapy dual ici regimen be gain momentum clinical trial have establish efficacy benchmark mechanistic insight remain scarce partly due limitation current preclinical model mimic complex tumor microenvironment tme give substantial heterogeneity hcc span genetic transcriptomic immunologic dimension treatment outcome vary widely additional factor such gut microbiota epigenetic modification far influence therapeutic response resistance pd-1 pd l1 ctla-4 inhibitor be widely use unresponsiveness be common novel target such lag-3 tim-3 tigit vista as well strategy to reprogram fibrotic immunosuppressive tme be active investigation ultimately translate basic insight personalized therapy will depend predictive biomarker integrated analysis account complex interaction tumor cell immune system tme review synthesize current knowledge cellular mechanism underpin combination therapy highlight therapeutic synergy discuss emerge direction stratified treatment hcc,Journal of hematology & oncology,2025 Sep 26
10.1159/000480657,geniposide attenuates post ischaemic neurovascular damage glun2a akt/,"Huang B, Chen P, Huang L, Li S, Zhu R, Sheng T, Yu W, Chen Z, Wang T",background aims calcium permeable ionotropic nmdar mediate hyperactivity be regard critical factor modulate development ischaemic stroke recently have be increase interest prevent post stroke neuronal death focus intervene function subpopulation nmdar downstream signal geniposide iridoid glycoside have be find to have cytoprotective function various condition however be still unclear geniposide affect neuronal insult experimental stroke method demonstrate dose dependent geniposide significantly decrease infarct volume tmcao model result medium level geniposide improve anti apoptotic function inhibited bbb leakage haemorrhage elevate glun2a contain nmdar expression tmcao rat importantly effect could be eliminate co treatment geniposide glun2a antagonist nvp not glun2b inhibitor ifenprodil moreover geniposide 's protection be due enhancement glun2a dependent survival signal include pakt perk psd-95 conclusion result suggest geniposide protect neuron post ischaemic neurovascular injury activation glun2a akt erk pathway very promising natural agent geniposide may be future therapeutic stroke patient,Cellular physiology and biochemistry : international journal of experimental,2017
10.1038/s41586-025-09574-y,spp1 be require maintain mesenchymal cell fate pancreatic cancer,"Li H, Lan L, Chen H, Zaw Thin M, Ps H, Nelson JK, Evans IM, Ruiz EJ, Cheng R, Tran L, Allen M, Ma J, Yi T, Wang C, He Y, Guppy N, Sadanandam A, Lin SZ, Zhang C, Behrens A","elucidate complex network communication tumour cell be central understand cell fate decision progression pancreatic ductal adenocarcinoma pdac)(1,2 previously show constant suppression bmp activity bmp antagonist grem1 secrete mesenchymal pdac cell be essential maintain fate epithelial pdac cells(3 here identify spp1 also know osteopontin)(4 key regulator mesenchymal cell fate pancreatic cancer proteomic analysis plasma patient pdac show spp1 be substantially upregulate late stage disease inactivation spp1 lead delay tumorigenesis mouse pdac model abolish metastasis formation spp1 be express epithelial pdac cell inactivation result conversion mesenchymal epithelial pdac cell mechanistically spp1 bind cd61 receptor mesenchymal pdac cell to induce bmp2 grem1 expression grem1 inhibition bmp signalling be require spp1 expression epithelial cell thereby form intercellular regulatory loop concomitant inactivation grem1 revert epithelial phenotype knockout fully mesenchymal pdac conversely grem1 heterozygosity combine knockout result wild type pdac histology result confirm direct antagonistic function factor hence mesenchymal epithelial pdac cell fate be determine reciprocal paracrine regulation soluble factor grem1 spp1",Nature,2025 Sep 24
10.1016/S0140-6736(25)01148-1,oral iptacopan therapy patient c3 glomerulopathy randomised,"Kavanagh D, Bomback AS, Vivarelli M, Nester CM, Remuzzi G, Zhao MH, Wong EKS, Wang Y, Krishnan I, Schuhmann I, Trapani AJ, Webb NJA, Meier M, Israni RK, Smith RJH",background c3 glomerulopathy be ultra rare severe form glomerulonephritis cause overactivation alternative complement pathway aim to assess efficacy safety iptacopan lnp023 oral proximal complement inhibitor target factor b to selectively inhibit alternative pathway complement cascade methods appear c3 g be multicentre randomise double blind placebo control phase 3 study iptacopan placebo addition supportive care renin angiotensin aldosterone system raas inhibitor immunosuppression adult participant age 18 60 year biopsy confirm c3 glomerulopathy be enrol 35 hospital medical centre 18 country inclusion criterion include reduce serum c3 concentration ie < 77 mg dl define < 0·85 × low limit central laboratory normal range screening urine protein creatinine ratio upcr 1·0 g g high day -75 day -15 randomisation estimate glomerular filtration rate egfr 30 ml min 1·73 m(2 high screening day -15 vaccination neisseria meningitidi streptococcus pneumoniae eligible participant be randomise 1:1 interactive response technology iptacopan placebo group stratify treatment corticosteroid mycophenolic acid yes no 6 month double blind period participant orally receive iptacopan 200 mg twice daily placebo be follow 6 month open label period participant receive iptacopan 200 mg twice daily primary endpoint be relative reduction proteinuria measure log transform ratio baseline upcr sample 24 h urine collection 6 month primary analysis be do full analysis set ie participant to study treatment be assign randomisation participant receive at least one dose study treatment be include safety analysis trial be register nct04817618 adult cohort have be complete finding july 28 2021 feb 15 2023 132 participant be screen 58 do not complete screening period 74 64 male 69 white be randomise 1:1 to receive iptacopan n=38 placebo n=36 one participant placebo group discontinue treatment open label period 24 h upcr percentage change relative baseline 6 month be -30·2 95 ci -42·8 -14·8 iptacopan group 7·6 -11·9 31·3 placebo group iptacopan group geometric mean 24 h upcr be 3·33 g 95 ci 2·79 3·97 baseline 2·17 g g 1·62 2·91 6 month placebo group be 2·58 g 2·18 3·05 baseline 2·80 g g 2·37 3·30 6 month primary endpoint be meet relative reduction 24 h upcr 6 month iptacopan placebo 35·1 13·8 51·1 p=0·0014 30 79 38 participant iptacopan group have treatment emergent adverse event compare 24 67 36 participant placebo group most be mild moderate severity be death treatment discontinuation due treatment emergent adverse event meningococcal infection serious adverse event be report three 8 participant iptacopan group one 3 participant placebo group interpretation iptacopan show statistically significant clinically meaningful proteinuria reduction addition raas inhibitor immunosuppression 6 month iptacopan be well tolerate acceptable safety profile patient c3 glomerulopathy funding novartis pharma,"Lancet (London, England)",2025 Sep 25
10.1136/gutjnl-2025-336391,gut microbial modulation 3 hydroxyanthranilic acid dopaminergic signalling,"Castells-Nobau A, Fumagalli A, Del Castillo-Izquierdo Á, Rosell-Díaz M, de la Vega-Correa L, Samulėnaitė S, Motger-Albertí A, Arnoriaga-Rodríguez M, Garre-Olmo J, Puig J, Ramos R, Burokas A, Coll C, Zapata-Tona C, Perez-Brocal V, Ramio L, Moya A, Swann J, Martín-García E, Maldonado R, Fernández-Real JM, Mayneris-Perxachs J",background obesity relate alteration gut microbiota have be link cognitive decline relationship attention remain poorly understand objective to evaluate possible relationship gut metagenomic plasma metabolomic attention design conduct faecal shotgun metagenomic target plasma metabolomic three independent cohort n=156 n=124 n=804 functional validation preclinical model include three faecal microbiota transplantation fmt experiment mouse drosophila melanogaster result obesity be consistently associate reduced attention metagenomic analysis identify proteobacteria specie microbial function relate biosynthesis anthranilic acid aa negatively associate attention obesity plasma metabolic profiling machine learning reveal 3 hydroxyanthranilic acid 3 haa be positively associate attention particularly obesity aa show negative association bariatric surgery improve attention enrich microbial specie link attention mouse diet induce obesity dio microbiota depletion reduce 3 haa 5 hydroxy indole acetic acid 5 hiaa concentration prefrontal cortex pfc be restore fmt global metabolic profiling > 600 metabolite pfc fmt group identify 3 haa tryptophan tyrosine pathway most significant mouse receive microbiota high attention donor second fmt experiment also reveal consistent enrichment tryptophan tyrosine metabolism transcriptional level pfc haao 3 hydroxyantrhanilic acid dioxygenase aox4 aldehyde oxidase 4 key 3 haa 5 hiaa degradation significantly regulate gene third fmt study attentional trait be transmit human mouse modulation serotonergic dopaminergic pathway drosophila mono colonisation enterobacter cloacae dio induce attention deficit like behaviour be mitigate 3 haa supplementation conclusion have identify microbiota 3 haa potential therapeutic target to improve attention especially obesity,Gut,2025 Sep 27
