DOI,Title,Authors,Abstract,Journal,Date
10.1186/s10020-025-01347-7,yulink deficiency promote cell death glucose restriction hcc cell,"Wu YC, Hung TH, Wang WT, Kuo MW, Liang YJ, Kuo YR, Hou MF, Lai CS, Yu AL, Yu J","background evolutionary genomics analysis identify yulink mios entrez gene 54,468 highly conserve gene encode 875 amino acid protein diverse function human give importance accelerated glycolysis hepatocellular carcinoma hcc explore expression function yulink hcc cell analyze clinicopathological datum to unveil impact patient survival method clinicopathological datum 184 patient resectable hcc be mine to establish correlation yulink expression patient survival employ reverse transcription quantitative polymerase chain reaction rt qpcr to assess yulink expression tumor tissue various assay include western blotting migration mtt cell cycle immunofluorescence oxidative stress tumorigenesis glucose uptake glycolytic function proximity ligation immunoprecipitation be conduct huh7 cell to identify regulatory mechanism glucose restriction result comparative evolutionary genomics analysis reveal patient high yulink expression have significantly short relapse free survival rfs overall survival os p < 0.0001 = 0.0015 respectively multivariable cox regression analysis identify yulink expression independent unfavorable predictor rfs hr 2.63 95 ci 1.58 4.38 p < 0.001 hcc furthermore yulink expression positively correlate huh7 migration survival especially response to glucose restriction yulink deficiency enhance glucose restriction induce cell death likely due increase reactive oxygen specie ros dna damage failure atm chk2 activation huh7 xenograft yulink suppression exhibit delay tumorigenesis immunocompromise nude mouse importantly proximity ligation assay immunoprecipitation demonstrate yulink colocalize interact glucose transporter 1 glut1 knockdown yulink not only suppress glut1 expression also disrupt glut1 translocation cytosol cell membrane result downregulate glucose uptake glycolysis conclusion result underscore protective role yulink hcc survival glucose restriction pivotal function glucose metabolism suggest mechanistic link low yulink expression high survival patient hcc","Molecular medicine (Cambridge, Mass.)",2025 Sep 26
10.3389/fonc.2021.763717,hpv type distribution hiv positive negative women without cervical,"Mcharo R, Lennemann T, France J, Torres L, Garí M, Mbuya W, Mwalongo W, Mahenge A, Bauer A, Mnkai J, Glasmeyer L, Judick M, Paul M, Schroeder N, Msomba B, Sembo M, Chiwerengo N, Hoelscher M, Geisenberger O, Lelle RJ, Saathoff E, Maboko L, Chachage M, Kroidl A, Geldmacher C","background woman live hiv sub saharan africa be increase risk to develop cervical cancer cc be cause persistent infection 13 oncogenic human papilloma virus hr hpvs be important to accurately identify target hiv positive woman high risk to develop cc early therapeutic intervention method total 2,134 hiv+ woman south west tanzania be prospectively screen cervical cancer precancerous lesion woman cervical cancer n=236 high- low grade squamous intraepithelial lesion hsil n=68 lsil n=74 lesion n=426 undergo high resolution hpv genotyping result eighty percent woman be diagnose hsil lsil be live hiv lesion young age hiv status deplete cd4 t cell count be independent risk factor hpv infection be predominantly cause hr hpv type multiple hr hpv type infection be predominant hiv+ woman hsil single type infection predominate hiv+ cc case p=0.0006 hpv16 18 45 account 85 68/80 75 82/110 hiv+ hiv- cc case respectively of note hpv35 most frequent hpv type hsil positive woman live hiv be rarely detect single type infection hsil cancer case conclusion hpv16 18 45 should receive special attention molecular diagnostic algorithm cc prevention program hiv+ woman sub saharan africa hpv35 may have high potential to induce hsil woman live hiv less potential to cause cervical cancer single type infection",Frontiers in oncology,2021
10.1016/j.jare.2025.09.042,therapeutic strategy exosome base bone regeneration osteoporosis,"Dayanandan AP, Bello AB, Arai Y, Lee SJ, Lee SH",background osteoporosis op be progressive bone disease mark reduce bone mass microarchitectural deterioration thereby increase fracture risk current therapy only partly restore bone quality often cause side effect long term use recent study highlight exosome subtype extracellular vesicle key regulator bone remodel promising regenerative potential however role osteoporosis remain underexplored aim review review aim to investigate establish role exosome bone regeneration may inform novel therapeutic strategy osteoporosis link general bone repair mechanism osteoporotic pathology evaluate translational potential limitation exosome base intervention key scientific concepts review exosomes derive mesenchymal stem cell osteoblast osteoclast macrophage regulate bone homeostasis modulate osteogenesis osteoclastogenesis immune response regenerative effect non osteoporotic setting be well document however challenge such exosome heterogeneity rapid clearance poor target efficiency impede direct application osteoporosis recent bioengineering approach include osteogenic rna protein loading surface modification bone targeting show promise moreover combine exosome immunomodulatory synergistic therapy may far enhance efficacy advance gap persist standardize isolation technique ensure batch consistency scale production clinical use review consolidate current knowledge outline direction adapt exosome base bone regenerative strategy osteoporosis treatment,Journal of advanced research,2025 Sep 25
10.1002/advs.202511671,parabiosis assembloids organoids pao,"Hong Y, Li L, Yan L, Bai L, Su J, Zhang X",research treatment major disease challenge global public health necessitating advanced disease model exist approach have clear limitation two dimensional cell culture lack multi organ interaction clinical trial be costly ethically constrain animal model focus single organ fail to replicate systemic regulation parabiosis connect two organism shared circulation provide insight systemic factor multi organ interaction have limit applicability human furthermore organoid be three dimensional structure form stem cell self organization replicate function individual tissue advance personalized medicine however can not model inter tissue interaction assembloid overcome constraint integrate diverse organoid enable sophisticated simulation multi organ dynamic integration parabiosis assembloid organoid pao model emerge technology such artificial intelligence precision analytic crispr base gene edit disease mechanism elucidation organ chip platform dynamic environmental control soft robotic replicate physiological biomechanic promise to revolutionize disease modeling regenerative medicine precision therapeutic review evaluate parabiosis assembloid organoid highlight development current limitation transformative potential combine frontier biomedical engineering approach to address complex human disease,"Advanced science (Weinheim, Baden-Wurttemberg, Germany)",2025 Sep 27
10.3390/ph18091261,pharmacogenomics tirzepatide genomic insight dual gip glp-1 agonist,"Song Z, Tang Y, Peng M, Han R, He P",type 2 diabete mellitus t2dm be frequently complicate atherosclerosis as substantial overlap underlying pathophysiological mechanism pose serious threat patient health tirzepatide novel dual agonist glucose dependent insulinotropic polypeptide gip glucagon peptide-1 glp-1 receptor have demonstrate remarkable efficacy glycemic control weight reduction cardiometabolic improvement make promising candidate manage t2dm comorbid as however substantial interindividual variability treatment response suggest role genetic determinant review systematically summarise current evidence pharmacogenomic variant influence efficacy toxicity tirzepatide explore interplay drug response gene genetic susceptibility t2dm highlight potential pharmacogenomic guide precision subtype individualised therapy finally highlight key challenge future direction clinical translation tirzepatide pharmacogenomic aim to inform personalize genomic guide therapy cardiometabolic disease,"Pharmaceuticals (Basel, Switzerland)",2025 Aug 25
10.1186/s12872-025-05131-7,endothelial activation stress index cardiovascular disease american,"Liu W, Xu X, Zhang M, Jin Y","background endothelial activation stress index easix derive measurement platelet count creatinine lactate dehydrogenase can serve indicator systemic inflammation endothelial dysfunction however association easix prevalence cardiovascular disease cvd general american adult have yet to be explore study aim to explore potential association methods cross sectional study participant nhanes 1999 2018 be analyze to examine association multivariable logistic regression analysis restrict cubic spline method be conduct supplement subgroup interaction analysis statistical analysis be perform r software version 4.1.3 result study comprise 38,794 subject prevalence cvd 10.4 median age be 49 year range 34 64 19866 51.2 be female adjust covariate elevate easix level be associate increase prevalence cvd adjust odd ratio aor 1.33 95 ci 1.26 1.41 myocardial infarction aor = 1.16 95 ci 1.10 1.23 angina pectoris aor = 1.15 95 ci 1.07 1.23 congestive heart failure aor = 1.29 95 ci 1.22 1.37 coronary heart disease aor = 1.23 95 ci 1.16 1.31 stroke aor = 1.16 95 ci 1.09 1.23 notable j shape association be observe significant inflection point 82.5 be more pronounced old subject hyperlipidemia furthermore easix demonstrate superior predictive capability cvd compare other individual index auc = 0.700 95 ci 0.691 0.709 conclusion elevated easix be associate great prevalence cvd american adult easix exhibit well performance evaluate association compare other individual index be expect easix can become more effective metric identify population early risk cvd",BMC cardiovascular disorders,2025 Sep 26
10.1016/j.disamonth.2025.102012,multiple sclerosis update safety efficacy bruton tyrosine kinase,"Prajjwal P, Patel PV, Patel ZV, Inban P, Patel D, Mahato P, Shamim L, Godinho NJS, Tekuru Y",background multiple sclerosis ms be chronic neurodegenerative autoimmune disease characterize cns inflammation demyelination current disease modify therapy dmt can reduce peripheral immune response impact cns compartmentalized inflammation remain limited bruton tyrosine kinase inhibitor btkis have emerge promising oral agent target b cell microglia objective to evaluate safety profile effectiveness two btk inhibitors- tolebrutinib evobrutinib management relapse multiple sclerosis method literature search be conduct use pubmed embase scopus randomize control trial publish 2020 2024 study compare evobrutinib tolebrutinib ms patient be screen evaluate base predetermine inclusion exclusion criterion four relevant rcts be match examine more detail result mri btk inhibitor show decrease gadolinium enhance lesion tolebrutinib demonstrate dose dependent efficacy reduce new gd enhance lesion t2 lesion count optimal effect 60 mg daily evobrutinib show dose dependent decrease serum neurofilament light nfl level relapse rate twice daily dosing provide great btk inhibition clinical benefit nasopharyngitis temporary increase liver enzyme mild gastrointestinal symptom be frequent side effect agent include study do not report direct clinical comparison cns penetration microglial modulation conclusion good safety efficacy profile treat relapse multiple sclerosis btkis evobrutinib tolebrutinib show promise have promise oral treatment future tolebrutinib might have well effect central nervous system to confirm long term result determine role progressive ms more phase iii trial be necessary,Disease-a-month : DM,2025 Sep 26
10.3390/cancers17182999,drug repurposing targeting cancer stem like cells glioblastoma,"De Sousa-Coelho AL, Solaković B, Bento AD, Fernandes MT",glioblastoma gbm be one deadly type cancer characterize short life expectancy diagnosis mostly related therapy resistance recurrence gbm stem like cell gscs reside tumor contribute feature therefore find drug specifically target such cell hold promise to halt gbm progression primary objective work be to comprehensively review discuss potential hard drug repurpose to target gsc several study evaluate drug show anti gsc activity originally approve non cancer indication be identify mainly include antidiabetic e.g. metformin phenformin sitagliptin antihypertensive e.g. nicardipine doxazosin prazosin antimicrobial e.g. pyrvinium pamoate flubendazole clofazimine central nervous system act drug e.g. chlorpromazine fluvoxamine disulfiram relevant candidate include disrupt gsc metabolism namely impairing mitochondrial function such metformin chlorpromazine pyrvinium pamoate multiple signal pathway may be involve namely wnt pi3k akt stat3 pathway other also significant be drug test combination result increase sensitivity temozolomide tmz standard pharmacological treatment available gbm repurpose agent such disulfiram metformin have already reach clinical testing none have yet be incorporate clinical practice importantly major translational barrier remain limited blood brain barrier penetration lack robust clinical trial conclusion drug repurposing be affordable suitable strategy to target gsc impair cell viability reduce stemness enhance sensitivity tmz have potential should be far explore to improve patient clinical outcome,Cancers,2025 Sep 14
10.1038/s41467-025-63285-6,structural basis antiphage defence atpase associate reverse,"George JT, Burman N, Wilkinson RA, de Silva S, McKelvey-Pham Q, Buyukyoruk M, Dale A, Landman H, Graham AB, DeLuca SZ, Wiedenheft B",reverse transcriptase rt have well establish role replication spread retrovirus retrotransposon however recent evidence suggest rt have be conscript cell diverse role antiviral defence here determine structure type i a retron explain rna dna rt hnh nuclease four molecule structure maintenance chromosome smc)-family atpase assemble 364 kda complex provide phage defence show phage encode nuclease trigger degradation retron associate dna lead activation hnh nuclease hnh nuclease cleave stall protein synthesis arrest viral replication take together datum reveal diverse paradoxical role rt perpetuation elimination genetic parasite,Nature communications,2025 Sep 26
10.1038/s41467-025-63324-2,hypoxic conditioning parkinson 's disease randomize control multiple,"Janssen Daalen JM, Meinders MJ, Giardina F, Mathur S, Ainslie PN, Thijssen DHJ, Bloem BR",preclinical evidence suggest positive symptomatic neuroprotective effect hypoxic conditioning parkinson 's disease pd study nct05214287 investigate safety feasibility short term symptomatic downstream effect hypoxic conditioning individual pd 20 individual pd mean age 62 10 woman hoehn yahr 1.5 3 complete randomize control double blind multiple n of-1 trial participant undergo five different 45 minute hypoxia intervention duplicate continuous hypoxia fio(2 0.163 0.127 intermittent five minute interval intersperse normoxia fio(2 0.163 0.127 placebo primary outcome be safety feasibility measure adverse event vital parameter disturbance participant rate discomfort feasibility questionnaire secondary outcome be short term participant rate assessor rate symptom score exploratory indicator target engagement be serum erythropoietin brain derive neurotrophic factor bdnf glial fibrillary acidic protein gfap neurofilament light chain nfl platelet derive growth factor receptor β pdgfrβ cortisol secondary outcome be evaluate use frequentist bayesian analysis 20 participant complete protocol trial meet primary endpoint safety feasibility 95 adverse event occur include one moderate three serious event adverse event be not dose dependent occur comparable incidence follow hypoxia placebo hypoxic conditioning be well tolerate low f(i)o(2 protocol cause significant oxygen desaturation two participant participant consider long term application feasible intermittent hypoxia f(i)o(2 0.163 modestly improve most participant rate symptom several hour compare placebo not assessor rate scale one hour intervention serum marker do not differ intervention hypoxic conditioning be safe feasible individual pd specific protocol may be associate short term symptom improvement finding inform support follow study long term safety efficacy hypoxic conditioning,Nature communications,2025 Sep 26
10.1080/19490976.2025.2558071,systemic gut microbiome change metformin liraglutide youth onset,"Glaros SB, Mishra SP, Jain S, Davis FS, Gabel SA, Mueller GA, Jarmusch AK, Mabundo L, Courville AB, Walter MF, Walter PJ, Overdahl KE, Yadav H, Chung ST",metformin met liraglutide lira be preferred diabetes therapy may improve glycemia modulate gut microbiome mechanism pathway be unknown few datum exist youth onset type 2 diabetes y t2d 3 month parallel clinical trial african american y t2d randomize met = 14 met+lira = 11 compare gut microbial composition metabolomic profile determine relationship change microbial abundance glycemia plasma metabolite 3 month met be associate great relative abundance eubacterium eubacterium rectale low bacteroides ovate p < 0.05 met+lira be associate great bacteroides fragili low streptococcus thermophilus p < 0.05 met group have increase > 1.5 fold plasma cholic secondary bile acid sulfochenodeoxycholic acid nutriacholic acid alpha muricholic acid c24 dihydroxy bile acid p ≤ 0.002 change nutriacholic acid correlate low fast glucose r = -0.7 p < 0.05 shift microbiota taxa be not associate plasma short chain fatty acid scfa hemoglobin a1c glucose short term met met+lira y t2d be relate distinct shift bile acid scfa produce gut microbiota taxa secondary bile acid metabolite correlate improved glycemia suggest bile acid pathway may be important modulator glycemia youth metformin clinical trials.gov identifi nct02960659,Gut microbes,2025 Dec
10.3791/64420,image aging cochlea light sheet fluorescence microscopy,"Santi PA, Johnson SB",deafness be most common sensory impairment affect approximately 5 430 million people worldwide world health organization(1 aging presbycusis be primary cause sensorineural hearing loss be characterize damage hair cell spiral ganglion neuron sgns stria vascularis structure reside cochlea have complex spiral shape anatomy membranous tissue suspend fluid surround bone property make technically difficult to investigate quantify histopathological change to address need develop light sheet microscope tslim can image digitize whole cochlea to facilitate study structure function relationship inner ear well align serial section whole cochlea result stack image three dimensional 3d volume rendering segmentation individual structure 3d visualization quantitative analysis i.e. length width surface volume number cochleae require minimal processing step fixation decalcification dehydration staining optical clearing be compatible subsequent high resolution imaging scan transmission electron microscopy tissue be present stack structure can be assess individually relative other structure addition imaging use fluorescent probe immunohistochemistry ligand binding can be use to identify specific structure 3d volume distribution cochlea here use tslim to examine cochleae aged mouse to quantify loss hair cell spiral ganglion neuron addition advanced analysis e.g. cluster analysis be use to visualize local reduction spiral ganglion neuron rosenthal 's canal 3d volume approach demonstrate tslim microscopy 's ability to quantify structure function relationship cochleae,Journal of visualized experiments : JoVE,2022 Sep 28
10.3390/ijms26188887,targeted biologic therapies hidradenitis suppurativa,"Tan IJ, Nguyen HN, Wolfe SM, Agarwal P, Cohen BA",chronic inflammatory disorder apocrine gland cidap such hidradenitis suppurativa hs be characterize painful recurrent lesion apocrine gland rich area first line treatment include retinoid antibiotic often fail to prevent recurrence biofilm formation necessitate use target biologic therapy review evaluate u.s.-based randomize control trial cohort study publish 2014 2024 efficacy such therapy adult hs patient total 13 study meet inclusion criterion agent target interleukin il-17a il-17f il-23 il-1α,International journal of molecular sciences,2025 Sep 12
10.1136/jitc-2025-012230,lactylation drive mvp upregulation boost immunotherapy resistance inhibit,"Liu S, Pan Y, Liu W, Bu X, Shao R, Wang Q, Wu J, Wu C, Hu W, Xu J, Wu C, Jiang J",background hepatocellular carcinoma hcc be prevalent malignancy third lead cause cancer relate mortality worldwide immune checkpoint inhibitor ici have emerge first line therapy advanced hcc substantially improve clinical outcome however resistance ici remain major therapeutic challenge lactylation recently identify post translational modification have be implicate tumor progression role ici resistance hcc remain unclear method cytotoxicity assay flow cytometry orthotopic hcc mouse model be use to evaluate effect lactylation remodel immune microenvironment chromatin immunoprecipitation sequence rna sequence be employ to identify lactylation regulate gene profile program cell death ligand 1 pd l1 protein degradation be assay cycloheximide chase analysis ubiquitination assay interaction major vault protein mvp β transducin repeat contain protein β trcp be analyze co immunoprecipitation experiment site direct mutagenesis truncation mutant be design to determine bind site mvp β trcp complex result elevated lactylation correlate poor prognosis ici resistance patient hcc inhibition lactylation enhance cd8(+ t cell infiltration cytokine production multiomics analysis identify mvp lactylation regulate factor suppress cd8(+ t cell mediate antitumor immunity elevated mvp expression be associate resistance checkpoint blockade therapy mechanistic study reveal histone lactylation induce mvp upregulation stabilize pd l1 prevent β trcp mediate proteasomal degradation pharmacological inhibition lactylation restore icis sensitivity orthotopic hcc mouse model conclusion finding demonstrate histone lactylation promote ici resistance mvp dependent pd l1 stabilization therefore target lactylation combination program cell death protein-1 pd l1 blockade offer promising strategy to overcome immunotherapy resistance hcc,Journal for immunotherapy of cancer,2025 Sep 21
10.3390/jcm14186678,rethink diabetes cardiovascular disease continuum toward integrated care,"Caturano A, Morciano C, Zielińska K, Russo V, Perrone MA, Berra CC, Conte C",type 2 diabete mellitus t2d cardiovascular disease cvd be not merely coexist epidemic co evolve manifestation share cardiometabolic continuum advance glycemic lipid blood pressure control residual cardiovascular risk remain high underscore limitation siloe approach perspective argue reframe t2d cvd interconnect condition drive inflammation adipose tissue dysfunction organ crosstalk metformin remain foundational several glucose lower drug class be now evaluate not only glycemic control also cardiovascular renal impact landmark trial recent meta analysis confirm sodium glucose co transporter 2 inhibitor glucagon peptide-1 glp-1 receptor agonist improve cardiorenal outcome more recently tirzepatide dual glucose dependent insulinotropic polypeptide gip)/glp-1 receptor agonist have show unprecedented efficacy weight glucose management potential to far transform cardiometabolic risk reduction enthusiasm therapy must be temper heterogeneity response treatment cost inequitable access integrated care model support multidisciplinary team digital health tool value base reimbursement be essential to close gap trial efficacy real world outcome attention sex age ethnicity comorbidity profile be critical to ensure equity be adaptation strategy to low- middle income country burden cardiometabolic disease be rapidly rise ultimately advance cardiometabolic medicine require not only novel therapy also unifying framework integrate biology behavior economic health system to deliver right treatment right patient right time,Journal of clinical medicine,2025 Sep 22
10.1007/s10142-025-01712-z,cancer gene therapy historical perspective current application future,"Zeng J, Luo J, Zeng Y",gene therapy have emerge transformative approach cancer treatment leverage genetic modification to target malignancy enhanced precision early effort face challenge such inefficient vector delivery < 5 tumor transduction rate first generation adenovirus immune response neutralize antibodie ~ 30 patient limited clinical efficacy < 10 objective response rate 1990 trial however advancement viral non viral vector e.g. aav achieve > 50 transduction efficiency solid tumor crispr cas9 90 target gene knockout rate preclinical model rna interference technology have revolutionize field presently gene therapy strategy include tumor suppressor gene restoration oncogene silence immune modulation demonstrate promise clinical outcome persistent hurdle target effect high cost emerge innovation personalize gene editing oncolytic virus combination therapy signal paradigm shift oncology review explore evolution gene therapy cancer highlight key milestone current application future direction could unlock full therapeutic potential,Functional & integrative genomics,2025 Sep 29
