DOI,Title,Authors,Abstract,Journal,Date
10.1038/s41591-025-03918-x,genomically match therapy advanced solid tumor randomized phase 2 rome,"Marchetti P, Curigliano G, Biffoni M, Lonardi S, Scagnoli S, Fornaro L, Guarneri V, De Giorgi U, Ascierto PA, Blandino G, D'Amati G, Aglietta M, Cremolini C, Conte P, Crimini E, Ceracchi M, Pisegna S, Verkhovskaia S, Bordonaro R, Bracarda S, Butturini G, Del Mastro L, DeCensi A, Fabbri A, Fenocchio E, Gori S, Metro G, Pessino A, Pozzessere D, Puglisi F, Tamberi S, Zambelli A, Marino D, Capoluongo E, Cappuzzo F, Cerbelli B, Giannini G, Malapelle U, Mazzuca F, Nuti M, Pruneri G, Simmaco M, Strigari L, Tonini G, Martini N, Botticelli A","recent advancement demonstrate potential tumor agnostic biomarker to guide effective therapy randomize evidence support clinical superiority precision oncology approach compare standard therapy remain limited rome trial be multicenter randomize open label phase 2 study compare tailor treatment tt standard care soc patient advanced solid tumor progress one two line therapy comprehensive genomic profiling tissue blood be perform to identify actionable alteration overall response rate orr be primary endpoint progression free survival pfs overall survival os time treatment failure ttf time next treatment ttnt safety be secondary endpoint november 2020 august 2023 1,794 patient be screen 897 be evaluate molecular tumor board mtb 400 be randomize tt soc. tt achieve significantly high orr 17.5 10 p 0.0294 improve median pfs 3.5 month 2.8 month hazard ratio = 0.66 0.53 0.82 p = 0.0002 tt also show superior 12 month pfs rate 22.0 8.3 median os be similar 52 crossover rate grade 3/4 adverse event be also similar 40 tt 52 soc result highlight potential tt to improve outcome patient diverse actionable genomic alteration result also provide relevant evidence support tumor agnostic precision oncology strategy highlight potential tts guide genomic profiling mtb recommendation to significantly improve outcome patient diverse actionable genomic alteration clinicaltrials.gov identifier nct04591431",Nature medicine,2025 Sep 29
10.3390/nu17182955,vitamin vascular health disease,Ayoub G,vascular health rely proper function endothelial cell regulate vascular tone blood fluidity barrier integrity endothelial dysfunction often aggravate inadequate vitamin absorption contribute spectrum clinical disorder include cardiovascular disease cerebrovascular disease peripheral artery disease age relate macular degeneration lymphedema chronic venous insufficiency b group vitamin especially folate vitamin b9 vitamin b12 b6 c d e be essential maintain endothelial function support dna synthesis regulate methylation enhance cellular repair mitigate oxidative stress inflammatory signaling curtail vascular damage folate be note central function one carbon metabolism convert homocysteine methionine thereby reduce vascular toxicity cover natural dietary source folate synthetic folic acid biologically active form 5 methyl-(6s)-tetrahydrofolate l-5 mthf l methylfolate 5 formyl-(6s)-tetrahydrofolate levoleucovorin therapeutic strategy to address vascular health prevent hyperhomocysteinemia order to preclude follow disorder include target vitamin supplementation dietary improvement to ensure sufficient intake bioavailable nutrient form certain clinical contexts use active l methylfolate levoleucovorin drug product bypass metabolic conversion issue evidence base intervention aim to restore endothelial homeostasis slow disease progression improve patient outcome variety disorder link poor vascular health,Nutrients,2025 Sep 15
10.1016/j.medcli.2025.107184,glp-1 base therapy obesity impact comorbiditie obesity relate,"Vilarrasa N, Pellitero S",agent target glucagon like peptide-1 receptor glp-1r be effective manage metabolic condition associate obesity such obstructive sleep apnea osa metabolic dysfunction associate steatotic liver disease masld chronic kidney disease ckd osa study first generation glp-1r agonist arglp-1 co agonist glp-1 gip have demonstrate significant improvement apnea hypopnea index weight reduction masld glp-1ras co agonist glp-1 gip glp-1 glucagon have show efficacy reduce hepatic fat improve fibrosis resolve steatohepatitis promising result trial such essence synergy nash ckd semaglutide have be associate reduction renal event slow disease progression metabolic cardiovascular benefit agent represent comprehensive approach treat obesity complication ongoing research explore potential indication chronic inflammatory disease such psoriasis hidradenitis suppurativa,Medicina clinica,2025 Sep 27
10.1002/anie.202517917,cleavable antibody conjugate aβ specific immune exosome combination,"Ma M, Wang J, Zhong W, Li Z, Zhao Y",recent progress antibody base immunotherapy alzheimer 's disease ad bring sense cautious optimism year setback however approach remain constrain suboptimal pharmacodynamic modest clinical benefit pro inflammatory adverse effect here develop β secretase responsive immunotherapeutic agent atexo cl aa synergistically target amyloid β aβ neuroinflammatory response achieve heighten efficacy reduce side effect associate conventional antibody therapy intranasal administration atexo cl aa actively migrate ad brain cleavage overexpressed β secretase atexo cl aa release aducanumab antibody aa exosome derive aβ antigen specific tregs atexo jointly manage aβ inflammatory microglia thereby synergistically eradicate aβ reduce pro inflammatory response ad mouse model atexo cl aa demonstrate efficient brain accumulation robust aβ removal microglial normalization neuroinflammation attenuation synaptic preservation ultimately lead improve cognitive function finding highlight atexo cl aa next generation immunotherapeutic transcend limitation conventional antibody base treatment ad,Angewandte Chemie (International ed. in English),2025 Sep 26
10.1038/s41598-021-98584-7,large bodied bird be over represent unstructured citizen science datum,"Callaghan CT, Poore AGB, Hofmann M, Roberts CJ, Pereira HM",citizen science platform be quickly accumulate hundred million biodiversity observation world annually quantifying correct bias citizen science dataset remain important first step datum be use to address ecological question monitor biodiversity one source potential bias dataset be difference citizen science program have unstructured protocol have semi structured structured protocol submit observation to quantify bias unstructured citizen science platform contrast bird observation unstructured inaturalist platform semi structured citizen science platform ebird continental united states test four trait specie body size commonness flock size color predict species be under- over represent unstructured dataset compare semi structured dataset find strong evidence large bodied bird be over represent unstructured citizen science dataset moderate evidence common specie be over represent unstructured dataset strong evidence specie large group be over represent evidence colorful specie be over represent unstructured citizen science datum result suggest bias exist unstructured citizen science datum compare semi structured datum likely result detectability species inherent recording process importantly program inaturalist detectability process be two fold first individual organism need to be detect second need to be photograph be likely easy many large bodied specie result indicate caution be warrant use unstructured citizen science datum ecological modelling highlight body size fundamental trait can be use covariate model opportunistic species occurrence record represent detectability identifiability unstructured citizen science dataset future research space should continue to focus quantify document bias citizen science datum expand research include structured citizen science datum to understand bias differ unstructured semi structured structured citizen science platform,Scientific reports,2021 Sep 24
10.3390/medicina61091569,proton pump inhibitors ppis)-an evidence base review indications efficacy,"Andrawes M, Andrawes W, Das A, Siau K",proton pump inhibitor ppi be most prescribed drug worldwide owe proven efficacy symptom control mucosal healing acid relate disorder include gastroesophageal reflux disease gord peptic ulcer disease helicobacter pylori eradication functional dyspepsia gastroprotection high risk patient however long term use approve indication be increasingly common have raise safety concern observational study link chronic ppi use myriad adverse outcome such enteric infection e.g. clostridioides difficile nutrient deficiency magnesium vitamin b12 osteoporotic fracture chronic kidney disease dementia gastric colorectal cancer causality be not always establish association warrant cautious risk benefit assessment patient receive prolonged therapy current guideline advocate periodic review ongoing ppi use emphasise deprescribe appropriate strategy include dose reduction demand intermittent use switch h2 receptor antagonist particularly patient non erosive reflux disease functional dyspepsia tool national institute health clinical excellence american college gastroenterology canadian deprescribing network assist clinician identify candidate tapering discontinuation narrative review focus concept ppi stewardship provide evidence base overview ppi indication risk deprescribe strategy to promote appropriate safe patient centre use acid suppressive therapy,"Medicina (Kaunas, Lithuania)",2025 Aug 31
10.3390/nu17183000,effect apple cider vinegar intake body composition humans type 2,"Castagna A, Ferro Y, Noto FR, Bruno R, Aragao Guimaraes A, Pujia C, Mazza E, Maurotti S, Montalcini T, Pujia A",background apple cider vinegar acv be naturally ferment beverage potential metabolic health benefit however effect weight loss remain controversial systematic review meta analysis randomize control trial rcts be conduct to assess effect acv anthropometric measurement adult method perform systematic search pubmed web science scopus central march 2025 randomize control trial rcts adult ≥18 year evaluate effect acv ≥4 week body composition parameter primary outcome include change body weight bmi waist circumference other anthropometric measure risk bias be assess use revised cochrane risk bias tool result 2961 report screen 10 rct comprise total 789 participant be eligible inclusion meta analysis pooled result use random effect model show daily acv intake significantly reduce body weight smd -0.39 95 ci -0.63 -0.15 p = 0.001 i(2 = 62 bmi smd -0.65 95 ci -1.05 -0.26 p = 0.001 i(2 = 83 wc smd -0.34 95 ci -0.67 -0.02 p = 0.04 i(2 = 61 however significant effect acv be observe other body composition parameter analyze sensitivity analyse exclude high risk bias study confirm robustness acv 's beneficial effect body weight bmi subgroup analysis suggest acv consumption significantly improve anthropometric parameter administer to 12 week dose 30 ml day adult be overweight obese have type 2 diabetes conclusion overall meta analysis suggest acv supplementation may be promising accessible adjunctive strategy short term weight management adult excess body weight metabolic complication,Nutrients,2025 Sep 19
10.1186/s13075-025-03647-z,glycolysis hif-1α axis induce il-1β macrophage rheumatoid arthritis,"Jia Y, Li R, Huang L, Wu X, Zhao L, Yang H, You X, Fei Y",background rheumatoid arthritis ra be aggressive systemic autoimmune disease overactivate macrophage play critical role pathogenesis study aim to explore potential role glycolytic reprogramme production proinflammatory cytokine macrophage ra methods seahorse assay be conduct ra healthy control hc serum treat human monocyte derive macrophage hmdms to evaluate glycolysis level rna sequence be perform to identify activate signal pathway key molecule hmdm stimulate ra serum proinflammatory cytokine hypoxia inducible factor 1α hif-1α be verify western blotting quantitative polymerase chain reaction qpcr result find hmdm stimulate ra serum show high aerobic glycolysis level treat hc serum high expression glycolysis relate gene include hexokinase2 hk2 pyruvate kinase l r pklr phosphoglycerate kinase 1 pgk1 furthermore ra serum treat macrophage exhibit high level interleukin-1 beta il-1β expression il-1β positively correlate hk2 inhibition glycolysis 3 bromopyruvate 3brpa hk2 knockdown significantly suppress il-1β production macrophage,Arthritis research & therapy,2025 Sep 26
10.1186/s13024-025-00891-4,hippo signal pathway therapeutic target alzheimer 's disease,"Chen D, Wigglesworth-Littlewood S, Gunn-Moore FJ",hippo signal pathway be well know regulation organ size cell proliferation apoptosis cell migration differentiation recent study have demonstrate hippo signal also play important role nervous system be involve neuroinflammation neuronal differentiation neuronal death degeneration such dysregulation hippo signal particularly core kinase mst1/2 lats1/2 have begin to attract attention alzheimer 's disease ad field here discuss therapeutic potential target hippo pathway ad provide overview hippo signal regard function nervous system evidence dysregulation ad patient model recent study involve genetic pharmacological modulation pathway ad,Molecular neurodegeneration,2025 Sep 26
10.1016/j.chom.2025.09.006,microbiota extend reproductive lifespan mouse safeguard,"Munyoki SK, Goff JP, Reshke A, Wilderoter E, Mafarachisi N, Kolobaric A, Sheng Y, Mullett SJ, King GE, DeSchepper JD, Bookser RJ, Castro CA, Gelhaus SL, Grizotte-Lake M, Morrison KE, Zeleznik AJ, Hand TW, Brieño-Enriquez MA, Jašarević E",infertility affect one six people underlie mechanism remain unclear show microbiota govern female reproductive longevity mouse germ free mouse have few primordial follicle increase atresia ovarian fibrosis lead small litter few offspring short reproductive lifespan germ free mouse be bear similar ovarian reserve display excessive activation impaired progression increase atresia post natal development microbiome colonization critical post natal window rescue premature ovarian reserve loss normalize follicle kinetic gene expression pattern change parallel increase short chain fatty acid scfas scfa administration mitigate ovarian dysfunction germ free mouse similar oocyte dysfunction occur conventionally raise mouse feed high fat diet additional dietary fiber help preserve oocyte quality embryo competence thus host microbe interaction shape female fertility microbiota target intervention may offer strategy to address reproductive disorder,Cell host & microbe,2025 Sep 25
10.1002/advs.202514008,extracellular vesicle packaged circtax1bp1 cancer associated fibroblasts,"Tan JN, Yu JH, Hou D, Xie YQ, Lai DM, Zheng F, Yang B, Zeng JT, Chen Y, Lu SH, Zhong GY, Han FH, Zhou SN",underlie molecular mechanism patient colorectal liver metastasis crlm remain unclear study be find cancer associate fibroblast cafs)-derive extracellular vesicle ev be significantly enrich circtax1bp1 crlm associate poor prognosis disruption ev package circtax1bp1 significantly inhibit crlm vivo vitro mechanistically caf derive ev package circtax1bp1 be deliver colorectal cancer crc cell bind virma promote lactylation lysine residue 1713 recruit aars2 lactylate virma enhance m(6)a base modification stability sp1 mrna sp1 mediate transcription tgf β enhance epithelial mesenchymal transition paracrine,"Advanced science (Weinheim, Baden-Wurttemberg, Germany)",2025 Sep 29
10.1016/j.xcrm.2025.102374,foundational architecture ai agent healthcare,"Liu F, Niu Y, Zhang Q, Wang K, Dong Z, Wong IN, Cheng L, Li T, Duan L, Li K, Li G, Hou TW, Fok M, Luo H, Chen X, Zhang K, Yin Y",medical ai agent represent transformative paradigm healthcare distinguish traditional ai autonomy adaptability ability to manage complex task review introduce conceptual framework agent build four core component planning action reflection memory examine framework 's application key clinical domain enhance diagnostic accuracy personalize treatment guide robotic surgery enable real time patient monitoring review critically analyze implementation challenge include technical integration clinician adoption regulatory adaptation ethical consideration datum privacy algorithmic bias future direction be explore include shift proactive multi agent collaborative system visionary ai agent hospital concept agent hold immense potential to revolutionize healthcare delivery improve efficiency patient outcome successful equitable integration hinge navigate profound technical ethical regulatory hurdle,Cell reports. Medicine,2025 Sep 26
10.1038/s42255-025-01355-1,non apoptotic caspase-8 meteorin pathway hepatocyte promote mash fibrosis,"Wang X, Moore MP, Shi H, Xiao Y, Zhang J, Faccioli LAP, Hu Z, Khalid S, Saleheen D, Stupack DG, Kisseleva T, Soto Gutierrez A, Lazar MA, Tabas I",metabolic dysfunction associate steatohepatitis mash be lead cause chronic liver disease incomplete understanding mash induce liver fibrosis have limit therapeutic option here show hepatocyte caspase-8 drive mash fibrosis apoptosis independent mechanism hepatic caspase-8 expression correlate liver fibrosis human experimental mash hepatocyte specific caspase-8 deletion male mouse mash suppress liver fibrosis hepatic stellate cell hsc activation affect hepatocyte apoptosis mechanistic study show caspase-8 yy1 pathway hepatocyte induce secretory meteorin metrn activate hsc c kit stat3 pathway meteorin expression be increase human male mouse mash liver decrease deletion hepatocyte caspase-8 mash mouse human mouse primary hepatocyte genetic restoration hepatocyte meteorin hepatocyte caspase-8 delete mash mouse restore hsc activation liver fibrosis silence hepatocyte meteorin lower liver fibrosis finding reveal therapeutically targetable pathway promote mash fibrosis involve non apoptotic function caspase-8 newly discover hsc activator meteorin,Nature metabolism,2025 Sep 26
10.1038/s41564-025-02120-6,nasal staphylococcus aureus carriage promote depressive behaviour mouse,"Xiang G, Wang Y, Ni K, Luo H, Liu Q, Song Y, Miao P, He L, Jian Y, Yang Z, Chen T, Xu K, Sun X, Shen Z, Ji C, Zhao N, He M, Pan Y, Luo Y, Hu J, Otto M, Li M",human microbiome have pronounce impact human physiology behaviour unique anatomical connection brain role nasal microbiome neurological disease be understudied here use human datum experiment mouse show nasal staphylococcus aureus be link depression nasal microbiome analysis reveal positive correlation depression score s. aureus abundance patient depression healthy control metabolomic nasal cavity show decrease sex hormone estradiol testosterone patient depression control nasal microbiota transplant patient reproduce depression like behaviour mouse differential abundance s. aureus further homology mutational analysis uncover s. aureus sex hormone degrade enzyme 17b hydroxysteroid dehydrogenase hsd12 degrade testosterone estradiol mouse lead low level dopamine serotonin murine brain finding reveal nasal commensal influence depressive behaviour provide insight nose brain axis,Nature microbiology,2025 Sep 22
10.1177/21501319251379740,healthcare utilization unchanged control arm randomized clinical,"Gongloor P, Nadeem S, Yu X, Raji M, Mena KD, Vaughan EM",background low income setting clinical trial participation may influence participant behavior include control group increase access care heighten health awareness trial enrollment could lead altered behavior phenomenon know hawthorne effect may obscure true intervention impact however effect remains poorly study low income environment aim to conduct secondary exploratory analysis healthcare utilization control participant randomized clinical trial rct methods retrospectively analyze electronic medical record control arm = 26 rct involve low income hispanic adult type 2 diabete receive care community clinic randomization 12 month diabetes education intervention usual care control participant undergo site measurement hba1c blood pressure weight healthcare utilization control participant be compare year before study include type exposure provider visit other service eg order result total healthcare utilization be similar pre period 11.9 exposure year study period 11.4 exposure year p = .93 significant change visit type be significant difference fit mean monthly visit pre- study period p = .93 time p = .89 conclusion exploratory study find evidence hawthorne effect healthcare utilization control participant may suggest consistent healthcare behavior may also highlight important public health concern individual low income setting may lack resource to translate increase awareness health relate action large study be need to far elucidate behavioral pattern low income population,Journal of primary care & community health,2025 Jan-Dec
10.1186/s40001-025-03108-y,identification hub gene immune infiltration lyme disease reveal,"Dong Y, Liu M, Luo Y, Chen Y, Chen X, Liu X, Cai X, Yang F, Song C, Zhou G",introduction lyme disease ld cause spirochete borrelia burgdorferi bb be multisystem disorder early symptom such erythema migrans late manifestation include arthritis neuroborreliosis molecular mechanism drive tissue damage inflammatory dysregulation ld remain incompletely characterize give central role peripheral blood mononuclear cell pbmc orchestrate immune response aim to identify optimal feature gene ofgs pbmc associate ld pathogenesis delineate immune infiltration pattern use integrated bioinformatic methods transcriptomic dataset gse42606 gse68765 gse103481 be retrieve geo differential expression analysis identify ld relate gene weighted gene co expression network analysis wgcna screen disease associate module feature selection be perform svm recursive feature elimination svm rfe least absolute shrinkage selection operator lasso regression random forest rf to pinpoint ofg immune cell infiltration be quantify use cibersort follow correlation analysis ofg immune subset single gene gene set enrichment analysis gsea be perform to explore functional association ofg biological pathway link ofg be infer single sample gsea ssgsea diagnostic utility be assess roc curve nomogram modeling finally use rt qpcr to confirm bioinformatics result result study identify 174 deg ld patient 156 gene locate turquoise module wgcna exhibit most robust correlation clinical characteristic kiaa1199 turn to be unique ofg select three distinct machine learn methodology possess exceptional diagnostic potential single gene gene set enrichment analysis show kiaa1199 be strongly correlate multiple immune relate pathway furthermore rt qpcr validate candidate gene expression thp-1 cellular model conclusion conclusion study integrate wgcna machine learn methodology to identify one core gene associate ld pbmc gene expression datum kiaa1199 predictive model construct use gene demonstrate robust diagnostic accuracy provide basis further research host immune response development new diagnostic method,European journal of medical research,2025 Sep 26
10.1186/s12951-025-03676-5,neutrophil membrane encapsulate nanosonosensitizer ultrasound reinforce,"Du C, Wang S, Cheng Y, Li J, Zhang Y, Li Z, Zhu B, Wu Z, Zhang X, Zhou L",pneumonia cause pseudomonas aeruginosa p. aeruginosa infection remain formidable clinical challenge persistent biofilm formation intrinsic antibiotic resistance exacerbate bacterial iron homeostasis stabilize biofilm architecture neutralize oxidative stress herein present fe tnt@nm biomimetic nanosonosensitizer activate ultrasound us to dismantle biofilm dual extracellular intracellular mechanism nanosonosensitizer feature iron dope titanate nanotube fe tnt core encapsulate neutrophil membrane nm us irradiation fe tnt@nm generate sonodynamic reactive oxygen specie ros extracellularly enhance fe(3 + release ion catalyze fenton reaction extracellularly to amplify chemodynamic effect disrupt intracellular iron homeostasis trigger bacterial ferroptosis nm coating enable immune evasion biofilm target delivery ultrasound reinforce ferroptosis strategy synchronize extracellular ros storm intracellular iron dyshomeostasis achieve dual action biofilm dismantling eradication drug resistant p. aeruginosa murine pneumonia model fe tnt@nm suppress biofilm mitigate pulmonary injury converge biomimetic targeting sonodynamic chemodynamic cascade ultrasound augment ferroptosis nanosonosensitizer present paradigm shift approach to combat refractory biofilm infection antibiotic resistance,Journal of nanobiotechnology,2025 Sep 26
10.1016/j.ejmech.2025.118197,bufalin target inhibit occurrence metastasis oral cancer,"Zhang H, Sun F, Ding X, Dong X, Yang F, Chen R, Zhang X, Wen Z, Su M, Yu C, Wang Y, Yang L, Li B",oral cancer oc be malignant tumor arise mucosal tissue oral cavity be commonly treat surgical resection bufalin be one most potent anticancer monomer extract bufonis venenum have be show to have anticancer effect wide range cancer include lung cancer gastric cancer hepatocellular carcinoma however be few study role bufalin oc lack clear target moreover bufalin be more difficult to apply clinically cardiac glycoside effect notably oral cancer be facial tumor bufalin act first oral tissue do not need to go blood circulation to reach heart greatly mitigate risk overcome major limitation effect bufalin proliferation migration oral cancer cell be detect cck-8 assay wound heal assay transwell assay western blot potential direct interact protein bufalin be screen human proteomic microarray bind site be predict use molecular docking technology vitro vivo biological experiment be perform to verify role bufalin direct interact protein mechanism bufalin target protein to inhibit oc metastasis result show bufalin inhibit proliferation migration oc cell line cal-27 hn30,European journal of medicinal chemistry,2025 Sep 23
