DOI,Title,Authors,Abstract,Journal,Date
10.1016/j.immuni.2025.09.003,intra tumoral hypoxia promote cd8(+ t cell dysfunction chronic activation,"Alicea Pauneto CDM, Riesenberg BP, Gandy EJ, Kennedy AS, Clutton GT, Hem JW, Hurst KE, Hunt EG, Green JM, Miller BC, Angus SP, Johnson GL, Esther RJ, Guerriero JL, Gao P, Soto-Pantoja DR, Ferris RL, Modliszewski JL, Coleman MF, Chung HK, Milner JJ, Moschos SJ, Wiseman RL, Thaxton JE",metabolic stress tumor microenvironment tme promote t cell dysfunction immune checkpoint inhibitor ici resistance examine contribution activate transcription factor 4 atf4 central node integrated stress response isr t cell dysfunction tumor cd8(+ tumor infiltrate lymphocyte til patient sample exhibit chronic atf4 activity be reflect various tumor model hypoxia tme impose chronic atf4 activity isr kinase atf4 overexpression cd8(+ t cell induce metabolic polarity mitochondrial oxidative stress cell death impair antitumor immunity chronic atf4 transcriptional activity replicate terminal exhaustion cd8(+ t cell state independent t cell receptor tcr stimulation genetic pharmacologic attenuation atf4 reduce mitochondrial oxidative stress promote cd8(+ til viability enable response program cell death protein-1 pd-1 inhibitor therapy confer protection re emergent disease thus isr converge chronic atf4 activity cd8(+ til barrier ici response position isr therapeutic candidate immunotherapy,Immunity,2025 Sep 25
10.1186/s13058-025-02123-5,hsa mir-155 5p expression primary breast tissue may have potential,"Koyama Y, Muguruma M, Horimoto Y, Narui K, Yamada A, Yamada K, Yamamoto S, Orihara S, Kaise H, Kogure A, Yoshioka Y, Ochiya T, Ishikawa T",background know incidence brain metastasis breast cancer useful biomarker have be clinically establish breast cancer brain metastasis bcbm present study aim to examine expression micrornas mirnas relate bcbm formalin fix paraffin embed ffpe tissue to identify usefulness predictive biomarker breast cancer brain recurrence bcbr methods pair primary breast metastatic site tissue sample be collect 38 patient experience first recurrence metastasis single distant organ brain lung liver bone 11/12/9/6 patient january 2007 december 2021 five institution japan evaluate expression 15 mirnas ffpe specimen untreated breast metastatic site same patient use quantitative polymerase chain reaction result analysis select 15 mirnas reveal hsa mir-155 5p exhibit significant bcbr specific overexpression untreated primary breast tissue p < 0.001 two other mirnas hsa mir-150 5p hsa mir-20b-5p exhibit moderate ρ = 0.587 weak ρ = 0.350 positive correlation hsa mir-155 5p respectively bcbr prediction model demonstrate high discrimination ability hsa mir-155 5p auc = 0.960 localization hsa mir-155 5p primary breast cancer tissue situ hybridization confirm hsa mir-155 5p be uniformly stain breast cancer cell conclusion hsa mir-155 5p expression untreated primary breast tissue may be valuable biomarker predict bcbr personalized escalation strategy be expect to be helpful conquer brain metastasis,Breast cancer research : BCR,2025 Sep 29
10.1007/s00432-025-06336-1,management hepatotoxicity associate cdk4/6 inhibitor rechallenge,"İlhan N, Baş S, Alkan O, Doğan A, Majidova N, Tunç MA, Erdemoğlu E, Öztosun B, Ökten İN, Gümüş M",background cyclin dependent kinase 4/6 cdk4/6 inhibitor combine endocrine therapy have significantly improve clinical outcome patient hormone receptor positive human epidermal growth factor receptor 2 negative hr + /her2- metastatic breast cancer hepatotoxicity be know class relate adverse event may interrupt modify treatment however real world evidence incidence risk factor management strategy particularly rechallenge approach remain limited study aim to evaluate frequency clinical characteristic cdk4/6 inhibitor associate hepatotoxicity to identify risk factor to assess outcome safety rechallenge follow liver injury methods retrospective multicenter study include 544 patient hr+ /her2- metastatic breast cancer be treat ribociclib palbociclib january 2017 july 2024 oncology center turkey abemaciclib be not include reimbursement limitation study period patient characteristic comorbiditie concomitant medication herbal dietary supplement use be record liver function test viral hepatitis serology be analyze hepatotoxicity be grade use common terminology criteria adverse events ctcae v5.0 causality be assess roussel uclaf causality assessment method rucam management strategy include dose interruption dose reduction switch cdk4/6 inhibitor outcome rechallenge be evaluate result hepatotoxicity occur 10.5 patient most commonly hepatocellular pattern ribociclib be most frequently use agent young age herbal supplement use hepatitis b carrier status be significantly associate increase risk hepatotoxicity hepatotoxic event be manage conservatively none patient develop acute liver failure require invasive evaluation dose reduction switch alternate agent be attempt most patient enzyme normalization be successful majority recurrence severe hepatotoxicity conclusion cdk4/6 inhibitor relate hepatotoxicity be manageable careful monitoring individualized strategy timely dose interruption switch agent cautious rechallenge allow most patient to resume therapy safely finding support continue use cdk4/6 inhibitor eligible patient even hepatotoxicity event,Journal of cancer research and clinical oncology,2025 Sep 27
10.1038/s41413-025-00456-7,unravel mechanism bone disease target dendritic cell,"Chen Y, Wang S, Chen X, Wu Z, He F, Chen Q",bone repair regeneration be complex spatiotemporal process recruit variety cell type need to precisely mediate effective healing post damage concept osteoimmunology emphasize extensive intricate crosstalk bone immune system significant advancement understand osteoimmunology precise role dendritic cell dcs field remain investigation key antigen present cell dcs be critical orchestrate adaptive immune response maintain tissue homeostasis recent research have far reveal potential dcs to influence development acceleration inflammatory autoimmune bone disease as well interaction skeletal cell context bone repair regeneration therefore depth understanding dcs osteoimmunology would be valuable herein discuss effect dcs bone homeostasis bone relate disease i.e. rheumatoid arthritis ra periodontitis bone regeneration other bone abnormality disease introduce innovative dcs target biomaterial aim promote bone repair regeneration furthermore summarize underlie crosstalk dcs other cell i.e. osteoclast mesenchymal stromal stem cell mscs hematopoietic stem progenitor cell hspc t b cell bone homeostasis bone relate disease conclusion propose osteoimmunology offer promising perspective unravel mechanism bone relate disease meanwhile target dcs perspective osteoimmunology may provide innovative idea resolution to achieve internal homeostasis balance,Bone research,2025 Sep 28
10.1093/brain/awaf360,myc drive gliosis impairs neuron glia communication amyotrophic lateral,"Fioretti PV, Barbieri A, Migazzi A, Bressan D, Grassano M, Donini L, Roccuzzo M, Torrieri MC, Conci F, Ferracci E, Invernizzi S, Bowden KM, Bacchetti F, Cappelli S, Peroni D, Belli R, Pancher M, Mugoni V, Scarduelli G, Gianesello M, Pasetto L, Canarutto G, Carra S, Soldano A, Bisio A, Robbiati S, Valentini C, Nardella C, Piazza S, D'Agostino VG, Quattrone A, Sleiman S, Whitfield JR, Soucek L, Vignoli B, Viero G, Tiberi L, Zippo A, Demichelis F, Bonetto V, Milanese M, Buratti E, Verde F, Ticozzi N, Calvo A, Ratti A, Shaw PJ, Terenzio M, Chiacchiera F, Pennuto M, Basso M",chronic activation glial cell lead dysfunction degeneration motor cortical neuron amyotrophic lateral sclerosis als frontotemporal dementia ftd unknown mechanism to shed light molecular pathogenetic process underlie exordium contribution gliosis to disease onset progression use cell mouse patient derive cell model tdp-43 sod1 c9orf72 link sporadic als datum reveal sequential disease progression start enhanced glial reactivity proliferation transition inflammation upregulation pro inflammatory gene use mouse genetic show expression mutant tdp-43 astrocyte be necessary to cause gliosis behavioral abnormality mechanistically show glial myc gain function drive neurodegeneration promote release astrocyte derive ev nonetheless fail to provide trophic support surround neuron research reveal novel functional role myc glia neuron miscommunication als,Brain : a journal of neurology,2025 Sep 26
10.1002/advs.202504138,adamts1 exacerbates post myocardial infarction scar formation mechanosensing,"Kong CY, Guo Z, Ma YL, Wang MY, Ni HY, Wang P, Qiu WJ, Wang EG, Li Z, Yang Z, Shen B, Tang QZ",-myocardial infarction mi remain lead cause morbidity mortality worldwide post infarction cardiac remodeling particularly excessive scar formation represent critical determinant patient outcome however mechanistic pathway govern pathological scar formation remain incompletely understood here demonstrate adamts1 disintegrin metalloproteinase thrombospondin motifs 1 significantly upregulate endothelial cell ecs follow mi play pivotal role regulate cardiac fibroblast activation novel mechanotransduction pathway involve integrin α8 itgα8 use ec specific adamts1 overexpression knockout mouse combine cardiac fibroblast specific itgα8 deletion model find adamts1 overexpression exacerbate cardiac dysfunction increase scar size adamts1 deficiency provide cardioprotection mechanistically adamts1 modulate extracellular matrix stiffness proteoglycan pg cleavage rather direct protein interaction activate itgα8 mechanosense specifically cardiac fibroblast integrin family member test itgα8 show selective responsiveness adamts1 mediate mechanical cue confirm tunable stiffness hydrogel experiment validate comprehensive proteomic functional analysis itgα8 deficiency rescue adamts1 induce cardiac dysfunction reduce pathological scar formation finding reveal previously unrecognized adamts1 itgα8 mechanotransduction pathway represent promising therapeutic target optimize post infarction cardiac remodeling,"Advanced science (Weinheim, Baden-Wurttemberg, Germany)",2025 Sep 27
10.1186/s40168-025-02230-7,gut gamete microbiome influence fertility preconception,"Munyoki SK, Vukmer N, Rios JM, Kallen A, Jašarević E",global fertility rate continue to decline advancement assist reproductive technology highlight significant gap understanding mechanism underlie preconception physiology commentary review grow body work demonstrate microbiome play crucial yet underexplored role woman 's reproductive health work have show microbial community produce substrate support metabolic immune hormonal function critical period affect fertility pregnancy outcome offspre health woman reproductive disorder include endometriosis polycystic ovarian syndrome primary ovarian insufficiency recurrent pregnancy loss harbor distinct microbial signature animal study provide key mechanistic insight show disruption microbiota accelerate ovarian aging translate finding human preconception health require careful consideration finding be compelling emerge field currently lack clear understanding microbial signal affect reproductive tissue metabolite immune response hormonal pathway outline criterion establish microbial causation preconception health include sufficiency necessity specificity timing move correlation involve select appropriate model focus key developmental window conduct longitudinal study conception investigate specific microbial metabolite influence reproductive outcome incorporate microbiome research preconception care could lead development new therapy intervention principle outline here primarily address preconception reproductive health also offer framework microbiome research general emphasize need mechanistic understanding timely intervention progress association causation rapidly evolve field,Microbiome,2025 Sep 26
10.1016/j.xcrm.2025.102372,phenotype obesity two dimensional tree structure reveal,"Jia X, Lin H, Ding Y, Hu C, Wang S, Li M, Xu Y, Xu M, Huang F, Shen F, Gu X, Mu Y, Chen L, Zeng T, Shi L, Su Q, Yu X, Yan L, Qin G, Wan Q, Chen G, Tang X, Gao Z, Hu R, Luo Z, Qin Y, Chen L, Hou X, Huo Y, Li Q, Wang G, Zhang Y, Liu C, Wang Y, Wu S, Zhu Y, Yang T, Deng H, Zhao J, Zhang Y, Xu X, Wei H, Zheng J, Wang T, Zhao Z, Ning G, Chen Y, Wang W, Bi Y, Lu J","obesity major public health challenge be characterize substantial phenotypic heterogeneity here employ discriminative dimensionality reduction tree ddrtree method to routine clinical datum 18,733 chinese individual obesity enrol nationwide china cardiometabolic disease cancer cohort 4c study identify five distinct metabolic phenotype phenotype characterize hyperglycemia insulin resistance exhibit high risk glycemic deterioration phenotype characterize hypertension dyslipidemia demonstrate elevated risk microvascular macrovascular disease finding be validate independent prospective cohort additionally reveal distinctive metabolomic feature contribute heterogeneity obesity 4c study to translate finding practice develop user friendly online tool to assess event risk obese population overall analysis illustrate underlie phenotypic variation influence subsequent obesity relate outcome emphasize importance precision medicine obesity management",Cell reports. Medicine,2025 Sep 25
10.1177/1060028015606469,association prenatal acetaminophen exposure future risk attention,"Hoover RM, Hayes VA, Erramouspe J",objective to evaluate effect prenatal acetaminophen exposure future development attention deficit hyperactivity disorder adhd child data source literature search medline 1975 june 2015 international pharmaceutical abstracts 1975 june 2015 cochrane database publication june 2015 prospective clinical trial assess relationship prenatal acetaminophen exposure development attention deficit disorder hyperactivity study selection data extraction study compare self report maternal acetaminophen use pregnancy development adhd adhd like behavior offspring age 3 12 year data synthesis four study examine effect prenatal acetaminophen exposure subsequent adhd behavior be identify one early study find link adhd behavior other study find statistically significant correlation most prominent be study find high risk use adhd medication hazard ratio = 1.29 95 ci 1.15 1.44 have adhd like behavior age 7 year determine strengths difficulties questionnaire risk ratio 1.13 95 ci 1.01 1.27 child mother use acetaminophen pregnancy conclusion do appear to be mild correlation prenatal acetaminophen use development adhd symptom child current datum do not provide sufficient evidence prenatal acetaminophen exposure lead development adhd symptom late life acetaminophen be preferred option pain management pregnancy compare other medication such nonsteroidal anti inflammatory drug opioid pyretic pain relief,The Annals of pharmacotherapy,2015 Dec
10.1007/s10549-022-06562-y,feasibility use autologous gm csf secrete breast cancer vaccine to,"Anderson KS, Erick TK, Chen M, Daley H, Campbell M, Colson Y, Mihm M, Zakka LR, Hopper M, Barry W, Winer EP, Dranoff G, Overmoyer B",purpose antigenic target immunity role vaccination breast cancer be unknown perform phase study autologous,Breast cancer research and treatment,2022 Jul
10.1016/j.cmet.2025.08.009,hebp2 govern glutamine competition tumor macrophage dictate,"Xiao Y （肖毅）, Xu Y （徐颖）, Wang H （王晗）, Yang F （杨帆）, Ding XH （丁晓洪）, Fu T （傅彤）, Chen L （陈力）, Jin X （金希）, Zhao YX （赵雅鑫）, Wang Y （王莹）, Chen F （陈芬芳）, Shao ZM （邵志敏）, Jiang YZ （江一舟）",immunotherapy demonstrate limited efficacy triple negative breast cancer tnbc influence intricate metabolic interaction tumor microenvironment here develop single cell rna sequence scrna seq immunotherapy cohort n = 27 spatial transcriptomic cohort n = 88 elucidate metabolic crosstalk associate therapeutic efficacy tnbc illustrate heme bind protein 2 hebp2)(high tumor cell feature active glutathione metabolism ccl3(+ macrophage characterize oxidative metabolism indicate immunotherapy efficacy be quantitatively spatially negatively correlate hebp2 mediate glutamine face off cell type induce phenomenon mechanistically hebp2 disrupt foxa1 cytoplasmic phase separation promote nuclear translocation upregulate glutathione s transferase p1 gstp1 expression glutamine consumption tumor cell metabolic shift induce ferroptosis ccl3(+ macrophage impair antitumor immunity utilization gstp1 inhibitor sensitize tnbc immunotherapy collectively delineate tumor macrophage metabolic checkpoint govern hebp2 gstp1 axis pioneer single cell level immunometabolism paradigm evaluate immunotherapeutic vulnerability,Cell metabolism,2025 Sep 23
10.1016/j.phymed.2025.157299,enzyme responsive liposome target endoplasmic reticulum stress mediate,"Li C, Qian C, Zhang J, Huang Y, Zhao X, Su H, Hou Y, Li C",background rheumatoid arthritis ra be chronic autoimmune disease characterize persistent synovial inflammation joint destruction insufficient apoptosis fibroblast like synoviocyte flss significantly contribute pathogenesis ra promote hyperplasia inflammatory cytokine secretion celastrol clt pentacyclic triterpene derive tripterygium wilfordii have show promise induce apoptosis endoplasmic reticulum er stress mediate pathway however clinical application be limit poor solubility target effect target delivery clt fls er could enhance therapeutic efficacy minimize toxicity method engineer clt load enzyme responsive liposome clt felipos functionalize hyaluronic acid ha oligopeptide gpa fap recognition fls er target kdel peptide cleavable peg chain vitro,Phytomedicine : international journal of phytotherapy and phytopharmacology,2025 Sep 23
10.1038/s41467-025-63349-7,exo1 therapeutic target fanconi anaemia zrsr2 brca1 a complex,"Maric M, Segura-Bayona S, Kuthethur R, Takaki T, Borel V, Stanage TH, Ivanov MP, Parnandi N, Hewitt G, Millar R, Fonseca CS, Patel H, Llorian M, Warchal S, Howell M, Chaudhuri AR, Kotsantis P, Boulton SJ",exonuclease exo1 perform multiple role dna replication dna damage repair ddr however exo1 loss be well tolerate suggest existence compensatory mechanism could be exploit ddr deficient cancer use crispr screening find exo1 loss synthetic lethal many ddr gene somatically inactivate cancer include fanconi anaemia fa pathway brca1 complex gene also identify spliceosome factor tumour suppressor zrsr2 synthetic lethal loss exo1 show zrsr2 deficient cell be attenuate fa pathway activation exhibit cisplatin sensitivity radial chromosome formation furthermore fa zrsr2 deficiency depend exo1 nuclease activity can be potentiate combination parp inhibitor ionize radiation finally uncover dysregulate replication couple repair driver synthetic lethality exo1 fa pathway attributable defective fork reversal elevated replication fork speed post replicative single strand dna exposure dna damage finding implicate exo1 synthetic lethal vulnerability promise drug target broad spectrum ddr deficient cancer unaddresse current therapy,Nature communications,2025 Sep 26
10.1007/s00421-010-1658-5,association basal serum bdnf cardiorespiratory fitness cardiovascular,"Jung SH, Kim J, Davis JM, Blair SN, Cho HC",evidence suggest serum brain derive neurotrophic factor serum bdnf can be affect cardiorespiratory fitness crf relationship be far clear recent report show inverse relationship serum bdnf crf healthy individual other study suggest possible association serum bdnf cardiovascular disease however possible interaction serum bdnf crf cardiovascular disease risk have not be study purpose study be to examine association serum bdnf crf cardiovascular disease risk factor healthy man investigation involve large sample man = 995 age range 20 76 year live central area south korea be recruit preventive health study study show significant inverse relationship serum bdnf relative vo(2)max r = -0.412 p < 0.0001 heart rate reserve r = -0.194 p < 0.0001 serum bdnf be positively correlate body mass index r = 0.80 p < 0.0001 total cholesterol r = 0.185 p < 0.0001 triglyceride r = 0.320 p < 0.0001 datum suggest serum bdnf may be associate effect increase crf cardiovascular disease however more research be clearly need determination extent serum bdnf may be responsible health benefit associate crf,European journal of applied physiology,2011 Feb
10.1126/sciadv.adw9275,reinforce plant derive lipid nanoparticle oral precise epigenome editing,"Gao Q, Gao Y, Cao Y, Xu H, Ma Y, Zu M, Yang Q, Yang K, Zhu Z, Liu C, Shi X, Reis RL, Kundu SC, Ma S, Han H, Xiao B",clinical application crispr cas9 remain limit delivery challenge particularly oral administration lysine specific demethylase 1 lsd1 play key role colonic inflammation tumorigenesis here develop oral genome editing platform tpgs rnp@lnp lsd1 target ribonucleoprotein rnps be encapsulate mulberry leaf lipid nanoparticle lnp formulate d α tocopherol polyethylene glycol succinate tpgs tpgs reinforce lipid bilayer lnp enhance gastrointestinal stability facilitate colonic mucus penetration galactose receptor mediate endocytosis tpgs rnp@lnps macrophage fusion endosomal membrane presence nuclear localization signal ensure nuclear delivery rnp tpgs rnp@lnps achieve 59.7 lsd1 edit efficiency macrophage surpass commercial crisprmax 43.0 oral tpgs rnp@lnps promote h3k4 methylation to modulate epigenetic state achieve inflammation mitigation epithelial barrier restoration retardation colitis associated tumorigenesis lnp base oral rnp delivery system tpgs rnp@lnps provide promising platform precise treatment colorectal disease,Science advances,2025 Sep 26
10.1186/s12879-025-11577-z,molecular epidemiology increase macrolide resistance bordetella,"Mai Q, Wen J, Luo Y, Guo J, Qin Y, Lai W, Deng W, Ji C, Mai R, Zheng M, Chen Z, Chen Y, Gu C, Guo L, Li H, Tang Y, Huang D, Luo M",background pertussis whoop cough highly contagious respiratory disease cause bordetella pertussis have resurge worldwide require increase attention study aim to characterize molecular epidemiology antimicrobial susceptibility profile b. pertussis isolate circulate guangzhou china methods total 91 culture confirm pertussis case guangzhou january 2020 august 2024 be enrol study b. pertussis isolate january 2020 may 2024 be recover 62 case isolate undergo antigenic genotyping phylogenetic analysis base whole genome sequencing antimicrobial susceptibility testing use e test be perform 12 representative isolate result majority culture confirm case occur child 1 year age be unvaccinate partially vaccinate genotypic analysis reveal significant shift only 3 isolate all 2022 harbor ptxp1 allele remain 59 exhibit ptxp3 three type pertactin prn allele be identify prn1 4.84 3/62 prn2 11.29 7/62 prn150 80.65 50/62 2 untype prn allele 2024 prn150 become predominant allele phylogenetic analysis reveal distinct branch separate ptxp1 ptxp3 lineage e test result demonstrate macrolide resistant isolate exhibit mic > 256 mg l erythromycin azithromycin clarithromycin carry a2047 g mutation 23s rrna gene proportion isolate harbor mutation increase significantly 2022 dominate 2024 test isolate display low mic alternative agent trimethoprim sulfamethoxazole mic ≤ 0.5/9.5 mg l cefoperazone sulbactam mic ≤ 0.064/0.032 mg l piperacillin tazobactam mic ≤ 0.064/4 mg l notably macrolide resistant isolate harbor ptxa1 ptxp3 prn150 genotype form distinct sub clone ptxp3 clade conclusion finding demonstrate current dominance macrolide resistant b. pertussis strain harbor ptxp3 prn150 guangzhou 2024 study provide epidemiological microbiological insight to guide local pertussis control strategy to offer antimicrobial resistance monitoring effort,BMC infectious diseases,2025 Sep 26
10.1126/sciimmunol.adx1582,design potent interleukin-21 mimic cancer immunotherapy,"Chun JH, Lim BS, Roy S, Walsh MJ, Abhiraman GC, Zhangxu K, Atajanova T, Revach OY, Clark EC, Li P, Palin CA, Khanna A, Tower S, Kureshi R, Hoffman MT, Sharova T, Lawless A, Cohen S, Boland GM, Nguyen T, Peprah F, Tello JG, Liu SY, Kim CJ, Shin H, Quijano-Rubio A, Jude KM, Gerben S, Murray A, Heine P, DeWitt M, Ulge UY, Carter L, King NP, Silva DA, Kueh HY, Kalia V, Sarkar S, Jenkins RW, Garcia KC, Leonard WJ, Dougan M, Dougan SK, Baker D",long stand goal cancer immunotherapy be to activate cytotoxic antitumor t cell range affinity tumor antigen suppress regulatory t cell computational protein design have enable precise tailoring protein to meet specific need here report de novo design,Science immunology,2025 Sep 26
